target_id,sequence,temporal_cutoff,description,all_sequences
2NOQ_1,UCUGGUCAGCAUGGC,2006-11-21,Structure of ribosome-bound cricket paralysis virus IRES RNA,N/A
5A2T_0,UUUUUUUUUUUUUUUUUUUUUUUUUUUUUUUUUUUUUUUUUUUUUUUUUUUUUUUUUUUUUUUUUUUUUUUUUUUUUUUUUUUUUUUUUUUUUUUUUUUUUUUUUUUUUUUUUUUUUUUUUUUUU,2015-07-22,The Molecular Basis for Flexibility in the Flexible Filamentous Plant Viruses,N/A
5YDT_0,UGGGCAUAUUCCA,2017-11-01,"Remodeled Utp30 in 90S pre-ribosome (Mtr4-depleted, Enp1-TAP)",N/A
7LJY_0,GGGUACUCUUUUCUUUGUCAUGGUUUUCUCAGGCGAAAGUCUGAGUUUUUACAUGACAAAGUUUUUAACGAGGCCC,2021-04-14,Cryo-EM structure of the B dENE construct complexed with a 28-mer poly(A),N/A
6QWL_0,GGCCUUGUUUCU,2019-09-04,Influenza B virus (B/Panama/45) polymerase Hetermotrimer in complex with 3'5' cRNA promoter,N/A
6QWL_1,AGCAAAAGCAGGCC,2019-09-04,Influenza B virus (B/Panama/45) polymerase Hetermotrimer in complex with 3'5' cRNA promoter,N/A
6YHS_0,GCGGG,2020-09-16,Acinetobacter baumannii ribosome-amikacin complex - 50S subunit,N/A
6YHS_1,CGCAACCA,2020-09-16,Acinetobacter baumannii ribosome-amikacin complex - 50S subunit,N/A
3JCS_0,UCAUCGAAUCGCCACCUACAAGACUGGAGCUUGCUCCCUCGAAGGCGCCAAGUAUAUUCAU,2016-07-20,2.8 Angstrom cryo-EM structure of the large ribosomal subunit from the eukaryotic parasite Leishmania,N/A
3T5Q_0,UUAUCUCC,2012-01-11,3A structure of Lassa virus nucleoprotein in complex with ssRNA,N/A
1RY1_0,CGAUCGGGUGUC,2004-04-20,Structure of the signal recognition particle interacting with the elongation-arrested ribosome,N/A
1RY1_1,AUCGCGCCUGUG,2004-04-20,Structure of the signal recognition particle interacting with the elongation-arrested ribosome,N/A
1MVR_0,,2003-04-01,"Decoding Center & Peptidyl transferase center from the X-ray structure of the Thermus thermophilus 70S ribosome, aligned to the low resolution Cryo-EM map of E.coli 70S Ribosome",N/A
1QZC_0,,2003-11-04,"Coordinates of S12, SH44, LH69 and SRL separately fitted into the cryo-EM map of EF-Tu ternary complex (GDP.Kirromycin) bound 70S ribosome",N/A
1MJ1_0,,2002-11-01,FITTING THE TERNARY COMPLEX OF EF-Tu/tRNA/GTP AND RIBOSOMAL PROTEINS INTO A 13 A CRYO-EM MAP OF THE COLI 70S RIBOSOME,N/A
8E8M_0,CCAAAAGAAGUCUUUCUUUUGGUUAACCAGGAU,2023-03-22,Mycobacterium tuberculosis RNAP paused elongation complex,N/A
5C0W_0,UAAAUAAAAAAA,2015-07-29,Structure of a 12-subunit nuclear exosome complex bound to single-stranded RNA substrates,N/A
7F3K_0,UCAUU,2022-06-22,Crystal structure of human YBX2 CSD in complex with m5C RNA in space group P21212,N/A
5Y85_0,GCCGCCGCUGGUGCAAGUCCAGCCACGCUUCGGCGUGGGCGCUCAUGGGU,2017-11-22,Structure-based Insights into Self-Cleavage by a Four-way Junctional Twister-Sister Ribozyme,N/A
7R6Q_0,GUUUGACCUCAAAUCAGGUAGGAAAGCUCAAAUUUGAAAUCUGGUACCUUCGGUGCCCGAGUUGUAAUUUGGAGAGGGCAACUUUGGGUUUGUAAAGUGCCUUCGAAGAGUCGCUAAGUGGGUGGUCCAUCUAAAGCUAAUAGUCGAUCCUAAGAGAUGGGGAAGCUCCGUUUCAAAGGCCUGAUUUUAUGCAGGCCACCAUCGAAAGGGAAUCCUUCCGGAACCUGGAUAUGGAUUCUUCACACUGAAUGUGGAGAAAAUCCACAGGAAGGAAUAGUUUUCAUGCCAGGUCGUA,2022-11-09,State E2 nucleolar 60S ribosome biogenesis intermediate - Foot region model,N/A
7R6Q_1,UGAACGCACAUUGCGCCCCUUGGUAUUCCAGGGGGCAUGCCUGUUUGAGCGUCAUUU,2022-11-09,State E2 nucleolar 60S ribosome biogenesis intermediate - Foot region model,N/A
4AL5_0,ACUGCCGUAUAGGCAG,2012-06-13,Crystal structure of the Csy4-crRNA product complex,N/A
8EYU_0,GCGCCGGUUAGGCAGAGGUGGGUGGUGUGGAGGAGUAUCUGUCCGGCGC,2023-05-31,Structure of Beetroot dimer bound to DFAME,N/A
8T2S_0,GAGCUCAUUUCUUUGUUUGCGCGCCAUGGGCGCGCUCUAACGGGUGUAAGUCCCGAACAUGCCCAGGUAGUGGGAAAUGUAUAGCCGAACAGCAAGGGUGUCUACUGUGAGGUGGAAUCUGAAGGAAGCUGUAAGCGAAUCUCUGGUCCGACGGACAGAAAUCGCAUAUAAGGCUAGGCUUCUGAUAAGCUGGCAAAGAACAGUGAAGUCUAAUAACUAAGCAGAGUAAAUGCGGCGGAUAUAUGGAGAGAAAGAGCGUGCACCUUAAGCGUGGAGGUCUCACAGAGGUUAGCCUAGUAACAACGAACUGUGAGAAGUCAGCCGAGCCCAUAGUAGUGAAGAAGUCUCUGUAAUGGGGAUGGAGCGAAGGGGCGAACAAUCAAUAAUGUCUCGUAUUGCAGAAAUGACAACAUCUGCCGUAACCAAUCGGGUAAAAGGUGGUCAAAUCAAGCGAGACGGAAAGGAAUUGAUUGAACCGCCGUAUACGGAACCGUACGUACGGUGGUGUGAGAGGUCGGAAUUUCUCAAUUAAGAGAAAUUCUUCCUACUCG,2023-11-22,Structure of a group II intron ribonucleoprotein in the pre-branching (pre-1F) state,N/A
8A57_0,UUAAGUUAGAAAGGGCGCACGGUGGAUGCCUUGGCACUAGGAGCCGAAGAAGGACGGGACUAACACCGAUAUGCUUUGGGGAGCUGUACGUAAGCGUUGAUCCAGAGAUUUCCGAAUGGGGGAACCCACUAUCUUUAGUCGGAUAGUAUCCUUACGUGAAUACAUAGCGUGAGGAAGGCAGACCCAGGGAACUGAAACAUCUAAGUACCUGGAGGAAGAGAAAGAAAAAUCGAUUUCCUGAGUAGCGGCGAGCGAAACGGAAAGAGCCCAAACCAAGAAGCUUGCUUCUUGGGGUUGUAGGACACUCUAUAUGGAGUUACAAAAGAAAGUUAUAAAUGAAGCGGUCUGGAAAGGCCCGCCAAAGACGGUAACAGCCCGGUAGUUGAAAUGGCUUUCCCUCCAGAGUGGAUCCUGAGUACGGCGGAACACGUGAAAUUCCGUCGGAAUCCGGGAGGACCAUCUCCCAAGGCUAAAUACUCCCUAGUGACCGAUAGUGAACCAGUACCGUGAGGGAAAGGUGAAAAGCACCCCGGAAGGGGAGUGAAACAGUUCCUGAAACCGUGUGCCUACAAGUAGUUAGAGCCCGUUAAUGGGUGAUAGCGUGCCUUUUGUAGAAUGAACCGGCGAGUUACGAUUUGUUGCAAGGUUAAGCGGAAAAAGCGGAGCCGUAGCGAAAGCGAGUCUGAAUAGGGCGCAUAAGUAACAGGUCGUAGACCCGAAACCAGGUGAUCUACCCAUGUCCAGGAUGAAGGUAAGGUAAUACUUACUGGAGGUCCGAACCCACGCACGUUGAAAAGUGCGGGGAUGAGGUGUGGGUAGCGGAGAAAUUCCAAUCGAACUUGGAGAUAGCUGGUUCUCUCCGAAAUAGCUUUAGGGCUAGCCUCGAGGUAAAGAGUCAUGGAGGUAGAGCACUGUUUGGACUAGGGGCCCUUCUCGGGUUACCGAAUUCAGAUAAACUCCGAAUGCCAUGUACUUAUACUCGGGAGUCAGACUGCGAGUGAUAAGAUCCGUAGUCGAAAGGGAAACAGCCCAGACCACCAGUUAAGGUCCCCAAAUAUAUGUUAAGUGGAAAAGGAUGUGGGGUUGCUUAGACAACCAGGAUGUUGGCUUAGAAGCAGCCACCAUUGAAAGAGUGCGUAAUAGCUCACUGGUCGAGUGACCCCGCGCCGAAAAUGUACCGGGGCUAAACAUAUUACCGAAACUGUGGAUGAACCGGUUCGUGGUAGGAGAGCGUUCUAAGGGCGGUGAAGUCAGACCGGAAGGACUGGUGGAGCGCUUAGAAGUGAGAAUGCCGGUAUGAGUAGCGAAAGAAGGGUGAGAAUCCCUUCCACCGAAUAUCUAAGGUUUCCUGAGGAAGGCUCGUCCGCUCAGGGUUAGUCGGGACCUAAGCCGAGGCCGAUAGGCGUAGGCGAUGGACAACAGGUAGAGAUUCCUGUACCAGUGCUAAUUGUUUAACCGAUGGGGUGACACAGAAGGAUAGGGAAUCGCACGAAUGGAAAUGUGCGUCCAAGCAGUGAGUGUGAGAAGUAGGCAAAUCCGCUUCUCGCGAAGCAUGAGCUGUGAUGGGGAACGGAAGUUCCUGAUUUCACGCUGUCAAGAAAAGCCUCUAGGAAGAGUAGUACUGCCCGUACCGCAAACCGACACAGGUAGAUGAGGAGAGAAUCCUAAGGUGAGCGAGAGAACUCUCGUUAAGGAACUCGGCAAAAUGACCCCGUAACUUCGGGAGAAGGGGUGCUCUAUUAGGGUGCAAGCCCGAGAGAGCCGCAGUGAAUAGGCCCAGGCGACUGUUUAGCAAAAACACAGGUCUCUGCAAAACCGUAAGGUGACGUAUAGGGGCUGACGCCUGCCCGGUGCUGGAAGGUUAAGAGGAGUGCUUAGCUUCGGCGAAGGUACGAAUUGAAGCCCCAGUAAACGGCGGCCGUAACUAUAACGGUCCUAAGGUAGCGAAAUUCCUUGUCGGGUAAGUUCCGACCCGCACGAAAGGCGCAACGAUCUGGGCACUGUCUCAACGAGAGACUCGGUGAAAUUAUAGUACCUGUGAAGAUGCAGGUUACCCGCGACAGGACGGAAAGACCCCGUGGAGCUUUACUGCAACCUGAUAUGGAAUGUUUGUACCGCUUGUACAGGAUAGGUAGGAGCCGAAGAGACGUGUGCGCUAGCAUACGAGGAGGCAAUGGUGGGAUACUACCCUGGCUGUAUGACCAUUCUAACCCGCCACGCUUAGCGCGUGGGGAGACAGUGUCAGGUGGGCAGUUUGACUGGGGCGGUCGCCUCCUAAAGAGUAACGGAGGCGCCCAAAGGUUCCCUCAGAAUGGAUGGAAAUCAUUCGCAGAGUGUAAAGGCACAAGGGAGCUUGACUGCGAGACUGACAAGUCGAGCAGGGACGAAAGUCGGGCUUAGUGAUCCGGUGGUUCCGCAUGGAAGGGCCAUCGCUCAACGGAUAAAAGCUACCCCGGGGAUAACAGGCUUAUCUCCCCCAAGAGUCCACAUCGACGGGGAGGUUUGGCACCUCGAUGUCGGCUCGUCGCAUCCUGGGGCUGUAGUCGGUCCCAAGGGUUGGGCUGUUCGCCCAUUAAAGCGGCACGCGAGCUGGGUUCAGAACGUCGUGAGACAGUUCGGUCCCUAUCCGUCGCGGGCGCAGGAAAUUUGAGAGGAGCUGUCCUUAGUACGAGAGGACCGGGAUGGACACACCGCUGGUGUACCAGUUGUUCCGCCAGGAGCAUCGCUGGGUAGCUAUGUGUGGCAGGGAUAAACGCUGAAAGCAUCUAAGCGUGAAGCCCCCCUCAAGAUGAGAUUUCCCAUUUCUUCGGAAAGUAAGAUCCCUGAAAGAUGAUCAGGUAGAUAGGUUUGGAGUGGAAGUGUAGCGAUACAUGGAGCGGACAAAUACUAAUCGAUCGAGGACUUAACC,2022-11-02,Cryo-EM structure of HflXr bound to the Listeria monocytogenes 50S ribosomal subunit.,N/A
6RA4_0,CGUGACUCU,2019-05-08,Human ARGONAUTE-2 PAZ DOMAIN (214-347) IN COMPLEX WITH CGUGACUCU,N/A
6RA4_1,CGUGACUCU,2019-05-08,Human ARGONAUTE-2 PAZ DOMAIN (214-347) IN COMPLEX WITH CGUGACUCU,N/A
3J0O_0,GCCCAGUGCUCUGAAUGUCAAAGUGAAGAAAUUCAACCAAGCGCGGGUAAACGGCGGGAGUAACUAUGACUCUCUUAAGGUAGCCAAAUGCCUCGUCAUCUAAUUAGUGACG,2011-11-16,Core of mammalian 80S pre-ribosome in complex with tRNAs fitted to a 9A cryo-EM map: classic PRE state 2,N/A
1H1K_0,AAAAAAAAAAAAAAAAAAAAAAAAAAAAAAAAAAAAAAAAAAAAAAAAAAAAAAAAAAAAAAAAAAAAAAAAAAAAAAAAAAAAAAAAAAAAAAAAAAAAAAAAAAAAAAAAAAAAAAAAAAAAAAAAAAAAAAAAAAAAAAAAAAAAAAAAAAAAAAAAAAAAAAAAAAAAAAAAAAAAAAAAAAAAAAAAAAAAAAAAAAAAAAAAAAAAAAAAAAAAAAAAAAAAAAAAAAAAAAAAAAAAAAAAAAAAAAAAAAAAAAAAAAAAAAAAAAAAAAAAAAAAAAAAAAAAAAAAAAAAAAAAAAAAAAAAAAAAAAAAAAAAAAAAAAAAAAAAAAAAAAAAAAAAAAAAAAAAAAAAAAAAAAAAAAAAAAAAAAAAAAAAAAAAAAAAAAAAAAAAAAAAAAAAAAAA,2002-09-26,THE BLUETONGUE VIRUS (BTV) CORE BINDS DSRNA,N/A
1H1K_1,UUUUUUUUUUUUUUUUUUUUUUUUUUUUUUUUUUUUUUUUUUUUUUUUUUUUUUUUUUUUUUUUUUUUUUUUUUUUUUUUUUUUUUUUUUUUUUUUUUUUUUUUUUUUUUUUUUUUUUUUUUUUUUUUUUUUUUUUUUUUUUUUUUUUUUUUUUUUUUUUUUUUUUUUUUUUUUUUUUUUUUUUUUUUUUUUUUUUUUUUUUUUUUUUUUUUUUUUUUUUUUUUUUUUUUUUUUUUUUUUUUUUUUUUUUUUUUUUUUUUUUUUUUUUUUUUUUUUUUUUUUUUUUUUUUUUUUUUUUUUUUUUUUUUUUUUUUUUUUUUUUUUUUUUUUUUUUUUUUUUUUUUUUUUUUUUUUUUUUUUUUUUUUUUUUUUUUUUUUUUUUUUUUUUUUUUUUUUUUUUUUUUUUUUUUUU,2002-09-26,THE BLUETONGUE VIRUS (BTV) CORE BINDS DSRNA,N/A
3EP2_0,,2008-12-16,Model of Phe-tRNA(Phe) in the ribosomal pre-accommodated state revealed by cryo-EM,N/A
1EMI_0,,2000-06-12,STRUCTURE OF 16S RRNA IN THE REGION AROUND RIBOSOMAL PROTEIN S8.,N/A
3J0O_0,GCUUGUGGCAGUCAAGCGUUCAUAGCGACAUUGCUUUUUGAUUCUUCGAU,2011-11-16,Core of mammalian 80S pre-ribosome in complex with tRNAs fitted to a 9A cryo-EM map: classic PRE state 2,N/A
6I84_0,UCUCACUGGA,2019-01-02,Structure of transcribing RNA polymerase II-nucleosome complex,N/A
8EGB_0,GGCAUAGUUGC,2023-03-01,Cryo-EM structure of consensus elemental paused elongation complex with an unfolded TL,N/A
4X2B_0,AUGGGCC,2015-05-06,K20A RNA dependent RNA polymerase mutant from Foot-and-Mouth disease Virus complexed with an RNA,N/A
4X2B_1,GGGCCC,2015-05-06,K20A RNA dependent RNA polymerase mutant from Foot-and-Mouth disease Virus complexed with an RNA,N/A
5LR4_0,GCGGUGGC,2017-06-21,RNA duplex has central consecutive GA pairs flanked by G-U basepairs with a methyl group on the adenine N6,N/A
5LR4_1,GCGGUGGC,2017-06-21,RNA duplex has central consecutive GA pairs flanked by G-U basepairs with a methyl group on the adenine N6,N/A
7SOP_0,AAA,2022-08-03,LaM domain of human LARP1 in complex with AAAUAA RNA,N/A
4CXH_0,UUUUUUUUUUUUUUUUUUUUUUUUUUUU,2014-07-16,Regulation of the mammalian elongation cycle by 40S subunit rolling: a eukaryotic-specific ribosome rearrangement,N/A
6NBJ_0,CCC,2023-04-26,Qri7,N/A
7P7T_0,GAGCCGUUAGCUCAGUGGAGCAUCUGACUUUACAGAGGGUCACAGGCGAGCCCUGUACGGCUCACCA,2022-02-23,"PoxtA-EQ2 antibiotic resistance ABCF bound to E. faecalis 70S ribosome, state III",N/A
6AEG_0,AACUCAAUUUGUAAAAAAGUUUUAGAGCUAGAAAUAGCAAGUUAAAAUAAGGCUAGUCCGUUAUCAACUUGAAAAAGUGGCACCGAGUCGGUGCU,2019-03-27,Crystal structure of xCas9 in complex with sgRNA and target DNA (GAT PAM),N/A
5L1Z_0,GAUCUGAGCCUGGGAGCUCUC,2016-10-26,TAR complex with HIV-1 Tat-AFF4-P-TEFb,N/A
7O7Z_0,GCACAAUCGUUUUUAUAAGGGUUUGCGGUGUAAGUGCAGCCCGUCUUACACCGUGCGGCACAGGCACUAGUACUGAUGUCGUAUACAGGGCUUUU,2021-06-02,Rabbit 80S ribosome stalled close to the mutated SARS-CoV-2 slippery site by a pseudoknot (classified for pseudoknot),N/A
7UU4_0,UAAUUU,2023-01-11,Crystal structure of APOBEC3G complex with ssRNA,N/A
1H1K_0,AAAAAAAAAAAAAAAAAAAAAAAAAAAAAAAAAAAAAAAAAAAAAAAAAAAAAAAAAAAAAAAAAAAAAAAAAAAAAAAAAAAAAAAAAAAAAAAAAAAAAAAAAAAAAAAAAAAAAAAAAAAAAAAAAAAAAAAAAAAAAAAAAAAAAAAAAAAAAAAAAAAAAAAAAAAAAAAAAAAAAAAAAAAAAAAAAAAAAAAAAAAAAAAAAAAAAAAAAAAAAAAAAAAAAAAAAAAAAAAAAAAAAAAAAAAAAAAAAAAAAAAAA,2002-09-26,THE BLUETONGUE VIRUS (BTV) CORE BINDS DSRNA,N/A
1H1K_1,UUUUUUUUUUUUUUUUUUUUUUUUUUUUUUUUUUUUUUUUUUUUUUUUUUUUUUUUUUUUUUUUUUUUUUUUUUUUUUUUUUUUUUUUUUUUUUUUUUUUUUUUUUUUUUUUUUUUUUUUUUUUUUUUUUUUUUUUUUUUUUUUUUUUUUUUUUUUUUUUUUUUUUUUUUUUUUUUUUUUUUUUUUUUUUUUUUUUUUUUUUUUUUUUUUUUUUUUUUUUUUUUUUUUUUUUUUUUUUUUUUUUUUUUUUUUUUUUUUUUUUUUU,2002-09-26,THE BLUETONGUE VIRUS (BTV) CORE BINDS DSRNA,N/A
7QTL_0,UCUGCUUCUGCUAU,2022-12-28,Influenza A/H7N9 polymerase elongation complex,N/A
7QTL_1,AUCUAUAAUAGCAGAAG,2022-12-28,Influenza A/H7N9 polymerase elongation complex,N/A
8WIB_0,CGCGGGGUGGAGCAGCCGGUAGCUCGUCUGGCUCAUAACCAGAAGAUCGUCGGUUCAAAUCCGGCCCCCGCAACCA,2024-02-28,"Cryo- EM structure of Mycobacterium smegmatis 70S ribosome, E- tRNA and RafH.",N/A
4TZ0_0,AAAAAAA,2014-12-31,DEAD-box helicase Mss116 bound to ssRNA and GDP-BeF,N/A
8BTR_0,AGCAGAGUGGCGCAGCGGAAGCGUGCUGGGCCCUCAACCCAGAGGUCGAUGGAUCGAAACCAUCCUCUGCUACCA,2023-03-22,Giardia Ribosome in PRE-T Hybrid State (D2),N/A
5MMI_0,CA,2017-01-11,Structure of the large subunit of the chloroplast ribosome,N/A
6EEN_0,UUUUUUUUU,2019-08-21,"Crystal structure of a designer Pentatrico Peptide RNA binding protein, bound to a complex RNA target and featuring an infinite superhelix and microheterogeneity.",N/A
5C0Y_0,UUUUUU,2015-08-05,Crystal structure of the Rrp6 catalytic domain bound to poly(U) RNA,N/A
3E3J_0,GGGAGUAA,2008-11-04,Crystal Structure of an Intermediate Complex of T7 RNAP and 8nt of RNA,N/A
1YSH_0,UAGACGGUGGGAGAGGGUGGUGGAAUUCCCGGAGUAGCGGUGAAAUGCGCAGAUACCGGGAGGAACGCCGAUGGCGAAGGCAGCCACCUGGUCCACCCGUG,2005-07-05,Localization and dynamic behavior of ribosomal protein L30e,N/A
1YSH_0,AACUCCGUGGAAGCCGUAAUGGCAGGAAGCGGA,2005-07-05,Localization and dynamic behavior of ribosomal protein L30e,N/A
2OM7_0,GCUCUUGGUCGCGCCUGCGUAGGAUAGGUGGGAGCCUGGCGCCGGUGAAAUCCACCCUGGCGCGGCUGGGGGC,2008-01-15,Structural Basis for Interaction of the Ribosome with the Switch Regions of GTP-bound Elongation Factors,N/A
2OM7_0,GCCAGGAGGUUGGCUUAGAAGCAGCCAUCCUUUAAAGAGUGCGUAAUAGCUCACUGGU,2008-01-15,Structural Basis for Interaction of the Ribosome with the Switch Regions of GTP-bound Elongation Factors,N/A
4V5Z_0,,2014-07-09,Structure of a mammalian 80S ribosome obtained by docking homology models of the RNA and proteins into an 8.7 A cryo-EM map,N/A
5K78_0,GUAUG,2016-12-07,Dbr1 in complex with 16-mer branched RNA,N/A
2WYY_0,UUUUUUUUUUUUUUUUUUUUUUUUUUUUUUUUUUUUUUUUUUUUU,2010-02-16,CRYOEM MODEL OF THE VESICULAR STOMATITIS VIRUS,N/A
6RXX_0,GGGGGGAUGUCCGGGUCGCCCUGGGCACCUCUCCCGGCAGCCUUCGCGGGCAGCCGUAGUCCCGGUUCAUACGGGCUCUGUGGGUGGGGGAAUUCAGGAGGGGAAAACGAUAGUUACCUGGUUGAUUCUGCUAGUCAUAUGCUUGUCUCAAAUAAGCCAUGCGUCUAAGUAUAAGCAAUUAUACAGCGAAACUGCGAAUGGCUCAUUAAAUCAGUUAUCGUUUAUUUGAUAGUACCUUACUACAUGGAUAACCGUGGUAAUUCUAGAGCUAAUACAUGCUGAAAAUCCCGACUUCGGAAGGGAUGUAUUUAUUAGAUUAAAAACCAAUGCCCUUCGGGGCGGUGAUUCAUAAUAACUUCUCGAAUCGCACGGCCUUGGCCGGCGAUGGUUCAUUCAAAUUUCUGCCCUAUCAACUUUCGACGGCUGGGUAUUGGCCAGCCGUGGUGACAACGGGUAAGGGUUAGGGCUCGGAGAAGGAGCCUGAGAAACGGCUACUACAUCCAAGGAAGGGCAGGCGCGCAAAUUACCCAAUCCCGACACGGGGAGGUAGUGACAAUAAAUACUGAUACAGGGCUCUUUCGGGUCUUGUAAUUGGAAUGAGUACAAUUUAAAUCCCUUAACGAGGAACAAUUGGAGGGCAAGUCUGGUGCCAGCAGCCGCGGUAAUUCCAGCUCCAAUAGCGUAUAUUGCUCGUAGUUGAACCUGGGCCUAGCCCGCCGGUCCGCCUCACCGCGUGCACUGGCUGGGCUGGGCCUGAUUAAUAGGGACAGUCGGGGGCGUCAGUAUUCAAUUGUCAGAGGUGAAAUUCUUGGAUUUAUUGAAGACUAACAACUGCGAAAGCAUUCGCCAAGGAUGUUUUCAUUAAUCAGGAACGUAAACUAUUAGGGAUCGGACGGCGUUUAUUUUUGACCCGUUCGGCACCUUACGAUAGGAGUAUGGUCGCAAGGCUGAAAAAUUGACGGAAGGGCACCACCAGGGGUGGAGCCUGCGCGCGCGCUACACUGACAGAGCCAGCGAGUACUCCCUUGGCCGAGAGGCCCGGGUAAUCUUGUUAAACUCUGUCGUGCUGGGGAUAGAGCAUUGCAAUUAUUGCUCUUCAACGAGGAAUCCCUAGUAAGCGCAAGUCAUCAGCUUGCGUUGAUUACGUCCCUGCCCUUUGUACACACCGCCCGUCGCUACUACCGAUAGAGGAAGUAGGUCUCCGUAGGUGAACCUGCGGAG,2019-08-14,"Cryo-EM structure of the 90S pre-ribosome (Kre33-Noc4) from Chaetomium thermophilum, state C, Poly-Ala",N/A
6RXX_1,AGCGACAAUACUUCAGAGAAUCAUUUCUAUAGUAGUUGUCCUCUCUUGUGUUUCCUAAAGGAGCCACAGAUCCCACCCGGGUUGAUGAACGAGAUCCUCGGCGCCAGUGAGGUCCUUUACUCUCGCUCUACCUGCAAAGGUGGCGGUCGCGUGCCUCGUCUCGCGGCUGUAUAGAGAGUGGCGAUGAUCUGUACCCCGCGGGGUGGGUGUCGAUGGAAGUCUGACCGGC,2019-08-14,"Cryo-EM structure of the 90S pre-ribosome (Kre33-Noc4) from Chaetomium thermophilum, state C, Poly-Ala",N/A
3J0O_0,GGAGGGCAAGUCAUGGUGCCAGCAGCCGCGGUAAUUCCAGCUCCAAUA,2011-11-16,Core of mammalian 80S pre-ribosome in complex with tRNAs fitted to a 9A cryo-EM map: classic PRE state 2,N/A
3J0O_0,GAGGUGAAAUUC,2011-11-16,Core of mammalian 80S pre-ribosome in complex with tRNAs fitted to a 9A cryo-EM map: classic PRE state 2,N/A
6RJA_0,UUGCGUUGAUAAAAGUAUUGUUUUUGUACUCUAGAAGCUACAAAGAUAAGGCUUCAUGCCGAAAUCAACACCGGUGUU,2019-10-02,Cryo-EM structure of St1Cas9-sgRNA-tDNA20-AcrIIA6 dimeric assembly.,N/A
3J0O_0,CACCGCCCGUCGCUUGUAGUAACGAAUGGUCUGGUGAACCUUCUGGACUGCGACAGCAAUGUUGCGGAAAAAUAAGUAAACCCUACCAUUUGGAACAACAAGAAGUCGUAA,2011-11-16,Core of mammalian 80S pre-ribosome in complex with tRNAs fitted to a 9A cryo-EM map: classic PRE state 2,N/A
4V5Z_0,,2014-07-09,Structure of a mammalian 80S ribosome obtained by docking homology models of the RNA and proteins into an 8.7 A cryo-EM map,N/A
4V4N_0,GGACGCUAAGCCGCCCGGUGGAUGGCUCGGCUCGGGGCGCCGACGAAGGGCGUGGCAAGCUGCGAUAAGCCCCGGCGAGGCGCAGGCAGCCGUCGAACCGGGGAUUCCCGAAUGGGACCUCCCGCGGCUUAUGCCGCACUCCGAGGGGGAACGCGGGGAAUUGAAACAUCUUAGUACCCGCAGGAAAAGAAAGCAAAAGCGAUGCCGUGAGUAGGGGCGACCGAAAACGGCAGAGGGCAAACUGAACCCCGGGCCGACGAGGUUCGGGGGAUGUGGGGUUGUAGGGCCCCCGUAUGAGACCCUCGCGGGUGAAGCCGAAGUCCGCUGGAACGCGGCGCCGGAGAGGGUGAUAGCCCCGUAGGCGUAAGCCCGCAGGGUCUCGGGGGACCCUGAGUACCGUCGGUUGGAUAUCCGGCGGGAAGCUGGGAGGCAUCGGCUCCCAACCCUAAAUACGUCCCGAGACCGAUAGCGAACUAGUACCGUGAGGGAAAGCUGAAAAGCACCCCGGGAGGGGGGUGAAAAGAGCCUGAAACCGGGCGGCGAUAGGAGGGUGCGGCCCGAAAGGAAUGAGCCUCCCCGAAGGAAACCGCGGCGACGCGGGAGUACGAGGGGAGGGGACCGGGGUUGCACCGUCCGUCUUGAAACACGGGGCAGGGAGUUCGCGGCCGUGGCGAGGUUAAGGGGGUUAAGCCCCGUAGCCGCAGGGAAACCGACAUGCCCGCAGCCGGGCCGGUGAGGGGCGGGGUGCGAAAGCGCCCGGAGUCACGGCCGCGAGACCCGAAACCGGUCGAUCUAGCCCGGGGCAGGGUGAAGUCCCUCAACCGAGGGAUGGAGGCCCGCUAGGGGUGCUGAUGUGCAGUUCGCUCCCGUGACCCCGGGCUAGGGGUGAAAGGCCAAUCGAGGCCGGAGAUAGCUGGUUCCCGCCGAAUCAUCCCGCAGGAUGGCCUCCCCGGAGGUAGGCGGUGGGGUAGAGCACUGAUUGGAGGUGCAGGGGGCGAAAGCCCCCGGCCUCCUGUCAAACUCCGAACCCACCGCCGCCGUAGAUGGGGGGAGUAGGGUGGCGGUGUAAGCCGUCCACCGAGAGGGGAACAACCCAGACCGGGGUUAAGGCCCCAAAGUGCCGGCUAAGUGUUACUCCAAAGGGUGUCCCGGGCCUUAGACAGCGGGGAGGUAGGCUUAGAAGCAGCCAUCCUUUAAAGAGUGCGUAACAGCUCACCCGUCGAGGUCCGGGGCCCCGAAAAUGGACGGGGCUCAAGCCGGCCGCCGAGACCCCGGCGCACGGAGUGAUCGGGUAGGCGGGCGUGCCGGUGGCGUAGAAGCCGGGCCGUAAGGUCCGGUGGAGCCGCCGGUAUCGCGGAUCCUGCCGGGAGUAGCAGCGUAGUCGGGUGAGAAUCCCGACCGCCGGAGGGGCCAGGGUUCCACGGCAAUGGUCGUCAGCCGUGGGUUAGUCGGUCCUAACCCCGCCCGUAACUCGGCGCGGGGGAAAGGGAAACGGGUUUAUAUUCCCGUACCGCGGGGGUAGGUGCGGCAACGCAAGCCCGGAGGGUGACGCCUCGGGGUAGGCGGACCGGCCGAUGAGGCCGGCUAAGCGUAUAAGCCCGGGGAGUGCCGUAAUGGCGAGAACCGGGUGAAAGCGCGAAUGGCCCCCCCGUUAGGGGGGUUCCGCCGAUCCCUGGGGCCCGUGAAAAGCCCUCCGGGAAUUCCGAUCCCCCGCGACCGUACCGAGAACCGACACAGGUGCCCCUGGGUGAGAAGCCUAAGGCGUGUCGGGGGAAACCCGGCCGAGGGAACUCGGCAAACUGGCCCCGUAACUUCGGGAGAAGGGGUGCCUGCGGGUGCGUAACCCGCAGGUCGCAGUGACUAGGGGGGCCCGACUGUUUAAUAAAAACACAGGUCCCAGCUAGCCCGAAAGGGUUUGUACUGGGGCCGACGCCUGCCCAGUGCCGGUAUGUGAAGCCCGGGUACAACCGGGUGAAGCACCGGUAAACGGCGGGGGUAACUAUAACCCUCUUAAGGUAGCGAAAUUCCUUGUCGGUUAAAUGCCGACCUGCAUGAAUGGCGUAACGAGGUCCCCGCUGUCCCCGGCCGGGGCCCGGCGAAACCUCUGCCUGGCGCGCAUGCCAGGGACCCCCGGUGGGAAGCGAAGACCCCAUGGAGCUUUACUGCAGCCUGCCGUUGCCACACGGCGGGGGGUGCGCAGCGUAGGCGGGAGGCGUCGAAGCCCGGCCUCCGGGUCGGGUGGAGCCGUCCAUGAGACACCGCCCACUCCCCGCUGUGUGGCUAACCCCCGAAAGGGGGGACAGCGGUAGGUGGGCAGUUUGGCUGGGGCGGCACGCCUCCGAAAAGGUAUCGGAGGCGCCCUAAGGUCGGCUCAGGCGGGUCAGGAAUCCGCCGUAGAGUGCAAGGGCAAAAGCCGGCCUGACUGGACCCGUAACAGAGGCGGGUCCAGCCCCGAAAGGGUGGCCUAGCGAACCCCUGUGCCUCCCCGGUGGGGGCCAGGGAUGACAGAAAAGCUACCCUGGGGAUAACAGAGUCGUCUCGGGCGAGAGCCCAUAUCGACCCCGAGGCUUGCUACCUCGCUGUCGGCUCUUCCCAUCCUGGCCCUGCAGCAGGGGCCAAGGGUGGGGGUGUUCACCCAUUAAAGGGGAACGUGAGCUGGGUUUAGACCGUCGUGAGACAGGUCGGAUGCUAUCUACCGGGGGUGUUGGCCGCCUGAGGGGAAGGUGCCCCUAGUACGAGAGGAACAGGGUGCCGCGGCCUCUGGUCUACCGGUUGUCCUCCCGGGCAUCGCCGGGCAGCUACGCCGCAGCCGAUAAGGCCUGAAAGCAUCUAAGGCCGAAGCGGCCCCCGAAAAUAGGCGGCCGUGGACGAGGGCUCGGGUAGAAGACCCGGUUGAUAGGGCGGGGAUGUAAGCGGGAAGGGUCAACCGACCCGCUUAGUCCGCCGCCCCUAAUCGCCCGAGGUCCUGC,2014-07-09,Structure of the Methanococcus jannaschii ribosome-SecYEBeta channel complex,N/A
6YFT_0,AUAUAUAUAUUAUAUAUAUA,2020-09-02,Virus-like particle of Wenzhou levi-like virus 1,N/A
7NAF_0,AUAGGGUGAAGCCAGAGGAAACUCUGGUGGAGGCUCGAAAAUGGAAUUAGACUGAAGGUCGGCGCCCUGGAGUUAUCUUUUCUUGUUUAUCCCGCUUCGGCCCCAAGGUGAACAGCCUCUAAUGUAGAUAAGGGAAGUCGGGGGAAUCUGACUGUUAACGAGAUUCCCACUGUCCCUAUCUACUCGGGGAACUGGCUUGUCGGCUCUUCCUAUCAUACCAUUCGGUAAGCGUUGGAUUCACCCACUAAUAGGGAACGUGGCUGAAUUGAACUUAGGAACAGUUCAUUCGGAUAAUUGGUUUUUGCGGCUGUCUGAUCAGGCAUUGCCGCGAAGCUACCAUCCGAAUCUAUAUAUUGUAAGCUGAGAUUAAGCCU,2022-11-09,State E2 nucleolar 60S ribosomal biogenesis intermediate - Spb1-MTD local model,N/A
6XBU_0,CCAAUGA,2021-06-09,polymerase domain of polymerase-theta,N/A
7TNY_0,GACGUACGUCG,2022-11-02,Cryo-EM structure of RIG-I in complex with p2dsRNA,N/A
7TNY_1,CGACGUACGUCC,2022-11-02,Cryo-EM structure of RIG-I in complex with p2dsRNA,N/A
8FJK_0,UAUAUAUAUAUAUAUAUAUAUAUAUAUAUAUAUAUAUAUAUAUAUAUAUAUAUAUAUAUA,2023-03-22,Golden Shiner Reovirus Core Polar Vertex,N/A
8FJK_1,UAUAUAUAUAUAUAUAUAUAUAUAUAUAUAUAUAUAUAUAUAUAUAUAUAUAUAUAUAUA,2023-03-22,Golden Shiner Reovirus Core Polar Vertex,N/A
1A9N_0,CCUGGUAUUGCAGUACCUCCAGGU,1998-09-23,CRYSTAL STRUCTURE OF THE SPLICEOSOMAL U2B''-U2A' PROTEIN COMPLEX BOUND TO A FRAGMENT OF U2 SMALL NUCLEAR RNA,N/A
5ZW4_0,CCUGCUUUGCGCAGG,2018-07-11,Crystal structure of tRNA bound TrmR,N/A
3DKN_0,CGUGCCAAGCUGCGAUAAGC,2008-08-19,Sec61 in the Canine ribosome-channel complex from the endoplasmic reticulum,N/A
3DKN_1,AGCCGCACGGAGGCGAA,2008-08-19,Sec61 in the Canine ribosome-channel complex from the endoplasmic reticulum,N/A
3BO0_0,CGUGAUGACGAGGCACUACGGUGCUGAAGCAA,2008-12-09,Ribosome-SecY complex,N/A
3ZN8_0,UGGUGCAGCGCAGCGCGGACGCCCGAACCUGGUCAGAGCCGGAAGGCAGCAGCCAUAAGGGAUGCUUUGCGGGUGCCGUUGCCUUCCG,2013-03-06,Structural Basis of Signal Sequence Surveillance and Selection by the SRP-SR Complex,N/A
6GD2_0,UUUAUUU,2018-10-31,Structure of HuR RRM3 in complex with RNA,N/A
3J45_0,UGAACAUUGAGCCUUGAUGUGUAGGAUAGGUGGGAGGCUUUGAAGUGUGGACGCCAGUCUGCAUGGAGCCGACCUUGAAAUACCACCCUUUAAUGUUUGAUGUUCUAA,2013-10-23,Structure of a non-translocating SecY protein channel with the 70S ribosome,N/A
6YMC_0,UCUCUGGUUAGGAAACUAACUAGGGA,2022-04-20,26-mer stem-loop RNA,N/A
7QTN_0,GGUAUGCGUACC,2023-01-25,Duplex RNA containing Xanthosine-Cytosine base pairs,N/A
7QTN_1,GGUACUGCGUACC,2023-01-25,Duplex RNA containing Xanthosine-Cytosine base pairs,N/A
4P5J_0,AGCUCGCCAGUUAGCGAGGUCUGUCUCGACACGACAGAUAAUCGGGUGCAACUCCCGCCCCUCUUCCGAGGGUCAUCGGAACC,2014-06-04,"Crystal structure of the tRNA-like structure from Turnip Yellow Mosaic Virus (TYMV), a tRNA mimicking RNA",N/A
6YDP_0,ACAGGUUUGGUCCUGGCCUUUCUAUUAAUUCUUAAUAAAAUUACACAUGCAAGUAUCCGCGCCCCGGUGAGAAUGCCCUCCAGAUCUUAAAGAUCAAAAGGAGCAGGUAUCAAGCACACCUAUAACGGUAGCUCAUAACGCCUUGCUCAACCACACCCCCACGGGAAACAGCAGUGAUAAAAAUUAAGCCAUGAACGAAAGUUUGACUAAGUUAUAUUAAUUAGAGUUGGUAAAUCUCGUGCCAGCCACCGCGGUCAUACGAUUAACCCAAAUUAAUAGAUCCACGGCGUAAAGAGUGUUUAAGAAAAAAAAUCACAAUAGAGUUAAAUUAUAACUAAGCUGUAAAAAGCCCUAGUUAAAAUAAAAUAACCCACGAAAGUGACUCUAAUAAUCCUGACACACGAUAGCUAGGACCCAAACUGGGAUUAGAUACCCCACUAUGCCUAGCCCUAAACCCAAAUAGUUACAUAACAAAACUAUUCGCCAGAGUACUACUCGCAACUGCCUAAAACUCAAAGGACUUGGCGGUGCUUCACAUCCACCUAGAGGAGCCUGUUCUAUAAUCGAUAAACCCCGAUAGACCUUACCAACCCUUGCCAAUUCAGCCUAUAUACCGCCAUCUUCAGCAAACCCUAAAAAGGAACAAUAGUAAGCACAAUCAUAGCACAUAAAAACGUUAGGUCAAGGUGUAGCUUAUGGGUUGGAAAGAAAUGGGCUACAUUUUCUACAUAAGAAUAUCCACCACACGAAAGUUUUUAUGAAACUAAAAACCAAAGGAGGAUUUAGCAGUAAAUCAAGAAUAGAGUGCUUGAUUGAAUAAGGCCAUGAAGCACGCACACACCGCCCGUCACCCUCCUCAAGCAUGUAGUAAUAAAAAUAACCUAUAUUCAAUUACACAACCAUGCAAGAAGAGACAAGUCGUAACAAGGUAAGCAUACUGGAAAGUGUGCUUGGAUUACC,2020-07-15,55S mammalian mitochondrial ribosome with mtEFG1 and P site fMet-tRNAMet (POST),N/A
6XRQ_0,GGCUCGGCGGCGGA,2021-07-28,Structural descriptions of ligand interactions to DNA and RNA quadruplexes folded from the non-coding region of Pseudorabies virus,N/A
6DOY_0,ACAUCG,2018-08-15,Crystal Structure of Bacillus Halodurans Ribonuclease H1 in Complex with an RNA/DNA Hybrid: Reaction in 2 mM Mg2+ and 200 mM Li+ for 120 s at 21 C,N/A
7VFT_0,GGGCCAGCAGCAGCAGCAGGUCC,2022-06-15,Crystal structure of rGGGC(CAG)5GUCC oligo,N/A
7Y7T_0,AAAG,2022-09-28,"QDE-1 in complex with 12nt DNA template, ATP and 3'-dGTP",N/A
7UVZ_0,GGCUAUGAGCUCAGUUGGUAGAGCACCGCACUCAUAAUGCGGGGGUCACAAGCAAGUCUCGUCAUAGCCACCA,2023-04-19,A. baumannii ribosome-Streptothricin-D complex: 70S with E-site tRNA,N/A
4JAB_0,GUGUAUAC,2014-01-29,U/G Wobble Base Pair in a RNA Duplex,N/A
4JAB_1,GUGUAUAC,2014-01-29,U/G Wobble Base Pair in a RNA Duplex,N/A
7VKL_0,ACGGACUC,2022-10-05,Crystal structure of MmIMP3-KH12 in complex with zipcode RNA,N/A
7D81_0,GGUUUCAACAUCCCCGUUCGGCGCUCGAAAGAGGUGGCCGGACUGAAGCC,2020-11-25,Crystal Structure of the Domain2 of NAD+ Riboswitch with nicotinamide adenine dinucleotide (NAD+),N/A
3NNC_0,UUGUGU,2010-10-27,Crystal Structure of CUGBP1 RRM1/2-RNA Complex,N/A
7MQA_0,GAUCGAUGUGGUGACG,2021-09-22,"Cryo-EM structure of the human SSU processome, state post-A1",N/A
7DCO_0,AAGCAGCUUUACAGAUCAAUGGCGGAGGGAGGUCAACAUCAAGAACUGUGGGCCUUUGCCUAUAGAACUUAUAACGAACAUGGUUCUUGCCUUUUACCAGAACCAUCCGGGUGUUGUCUCCAUAGAAACAGGUAAAGCUGUCCGUUACUGUGGGCUUGCCAUAUUUUUUGGAACUUUUC,2021-03-17,Cryo-EM structure of the activated spliceosome (Bact complex) at an atomic resolution of 2.5 angstrom,N/A
8PSQ_0,AAAUUUUACUCAC,2023-12-27,Tilapia Lake Virus polymerase in cRNA pre-initiation state mode A (core only),N/A
7ZTA_0,UGGGGUACGCCAAGGAAGGCACCGGAUCUGCCGGCAUCCGAGGCGAAUCCUCGUACCCAG,2023-04-12,Structure of an Escherichia coli 70S ribosome stalled by Tetracenomycin X during translation of an MAAAPQK(C) peptide,N/A
6DTA_0,UUGGUGG,2018-07-11,Bacteriophage N4 RNA polymerase II elongation complex 2,N/A
8PSQ_0,GUGAGAAAGAUUUGC,2023-12-27,Tilapia Lake Virus polymerase in cRNA pre-initiation state mode A (core only),N/A
6L5N_0,UUUUUUU,2020-06-17,Crystal structure of human DEAD-box RNA helicase DDX21 at post-unwound state,N/A
3R2D_0,GGCUCCUUGGCA,2011-06-22,Crystal Structure of Antitermination Factors NusB and NusE in complex with dsRNA,N/A
3R2D_1,CCUUGGCA,2011-06-22,Crystal Structure of Antitermination Factors NusB and NusE in complex with dsRNA,N/A
8PSO_0,GUGAGUAAAAUUUGG,2023-12-27,Tilapia Lake Virus polymerase in vRNA initiation state (core only),N/A
4V5Z_0,,2014-07-09,Structure of a mammalian 80S ribosome obtained by docking homology models of the RNA and proteins into an 8.7 A cryo-EM map,N/A
5W0O_0,GCGAAGCGCUUCGCU,2017-06-28,Structure of human TUT7 catalytic module (CM) in complex with dsRNA,N/A
5W0O_1,GCGAAGCGCUUCGCU,2017-06-28,Structure of human TUT7 catalytic module (CM) in complex with dsRNA,N/A
4C4Q_0,GACUAGCCGUAGUGGCGAGCUCCCUGGGUGGUCUAAGUCCUGAGUACAGGACAGUCGUCAGUAGUUCGACGUGAGCACUAGCCCACCUCGAGAUGCUACGUGGACGAGGGCAUGCCCAAGACACACCUUAACCCUGGCGGGGGUCGCUAGGGUGAAAUCACAUUAUGUGAUGGGGGUACGACCUGAUAGGGUGCUGCAGAGGCCCACUAGCAGGCUAGUAUAAAAAUCUCUGC,2013-10-30,Cryo-EM map of the CSFV IRES in complex with the small ribosomal 40S subunit and DHX29,N/A
4V5Z_0,,2014-07-09,Structure of a mammalian 80S ribosome obtained by docking homology models of the RNA and proteins into an 8.7 A cryo-EM map,N/A
