target_id,sequence,temporal_cutoff,description,all_sequences
1YSH_0,GAUGAAGCGUGCCGAAAGGCACGUGGAA,2005-07-05,Localization and dynamic behavior of ribosomal protein L30e,N/A
8ATT_0,GUA,2023-08-30,"Cryo-EM structure of yeast mitochondrial RNA polymerase transcription initiation complex with 4-mer RNA, pppGpGpUpA (IC4)",N/A
7SOU_0,AAA,2022-08-03,LaM domain of human LARP1 in complex with AAAAAA polynucleotide,N/A
2M23_0,GGAGUAUGUAUUGGCACUGAGCAUACUCC,2013-12-18,NMR solution structure of the d3'-hairpin of the group II intron Sc.ai5gamma including EBS1 bound to IBS1,N/A
8SQK_0,AGCAUGCUACGUCAUUCUCCACGCGAAGCAUG,2023-11-22,"SARS-CoV-2 replication-transcription complex bound to RNA-nsp9 and GDP-betaS, as a pre-catalytic deRNAylation/mRNA capping intermediate",N/A
8SQK_1,UGUCAUGCUUCGCGUGGAGAAUGACGUAGCAUGCU,2023-11-22,"SARS-CoV-2 replication-transcription complex bound to RNA-nsp9 and GDP-betaS, as a pre-catalytic deRNAylation/mRNA capping intermediate",N/A
8SA6_0,GGUUAAAGCCUUAUGGUCGCUACCAUUGCACUCCGGUAGCGUUAAAAGGGAAGACGGGUGAGAAUCCCGCGCAGCCCCCGCUACUGUGAGGGAGGACGAAGCCCUAGUAAGCCACUGCCGAAAGGUGGGAAGGCAGGGUGGAGGAUGAGUCCCGAGCCAGGAGACCUGCCAUAAGGUUUUAGAAGUUCGCCUUCGGGGGGAAGGUGAACA,2023-07-26,apo form of adenosylcobalamin riboswitch dimer,N/A
2MVY_0,GGACUAGUCC,2015-09-30,Structure and Stability of RNAs Containing N6-Methyl-adenosine,N/A
2MVY_1,GGACUAGUCC,2015-09-30,Structure and Stability of RNAs Containing N6-Methyl-adenosine,N/A
2VAZ_0,,2007-10-02,Model of the S15-mRNA complex fitted into the cryo-EM map of the 70S entrapment complex.,N/A
2BJ6_0,GGCAUUACGG,2005-03-09,Crystal Structure of a decameric HNA-RNA hybrid,N/A
2LI4_0,GGACCGAUAAGGUAGAAAUGCCUUAUCGGUCC,2012-08-22,Solution structure of a shortened antiterminator hairpin from a Mg2+ riboswitch,N/A
5F5F_0,UGACUGCGUUUUAGGAGUUA,2016-04-06,X-ray structure of Roquin ROQ domain in complex with a Selex-derived hexa-loop RNA motif,N/A
7YOJ_0,GUCUGCCGAAGACGCCGCACGGAGCCUGGGCCGGAAUCGUAGAUCGAACGCGGCAUCGAAGCCCUGCAGCCCUUCGGGGCCAAGGCGGCGCAGCAAGCCUCUUUCAGGCGGCAGAGUCCUUUAGAGUGUGAGAGACACUCUAAAGGAAUGAAAGAGGGCGACACCCUGGUGAAC,2023-02-15,Structure of CasPi with guide RNA and target DNA,N/A
2XEA_0,GAA,2010-06-30,4.6 ANGSTROM CRYO-EM RECONSTRUCTION OF TOBACCO MOSAIC VIRUS FROM IMAGES RECORDED AT 300 KEV ON A 4KX4K CCD CAMERA,N/A
8QO4_0,UUUUUCAGUUAGAGCGUCGUGUCUCUUGUACGUCUCGGUCACAAUACACGGUUUCGUCCGGUGCGUGGCAAUUCGGGGCACAUCAUGUCUUUCGUGGCUGGUGUGACCGCGCAAGGUGCGCGCGGUACGUAUCGAGCAGCGCUCAACUCUGAAAAA,2024-03-06,Conserved Structures and Dynamics in 5-Proximal Regions of Betacoronavirus RNA Genomes,N/A
5F6C_0,GUG,2016-12-14,The structure of E. coli RNase E catalytically inactive mutant with RNA bound,N/A
6T34_0,UUUUU,2019-11-13,Atomic model for Turnip mosaic virus (TuMV),N/A
7Q22_0,GGGGGGGGGGGGGGGGGGGGGGGGGGGGGGGGGGGGGGGGGGGGGGGGGAAAAAAAAAAAAAAAAAAAAAAAAAAAAAAAAAAAAAAAAAAAAAAAAAAAAAAAAAAAAAAAAAAAAAAAAAAAAAAAAAAAAAAAAAAAAAAAAAA,2022-09-21,cryo iDPC-STEM structure recorded with CSA 2.0,N/A
6T0R_0,AGUAGUAACAAGAGUCUGCU,2020-04-15,Bat Influenza A polymerase product dissociation complex using 44-mer vRNA template with mutated oligo(U) sequence,N/A
4V8M_0,UGGAAAUGCGAAACACUUGCCAGGUGACCCAUCCAUCCUCCCACGGUGAGCUUUCUUUUCACCAUAAUCCACAUCUCCGGCCUUGCUGGGGCUUGGGCCUCUCGACUUCUCGCGUUACUCGGAGCGGGGGCUCAAGAUUGAAAAAUGCAGCUCACCCUACGUACUGUCCUUUGUUGUGAGUUCGGCGCAUUAAAGCAAAAACCUGGGGUG,2014-07-09,High-resolution cryo-electron microscopy structure of the Trypanosoma brucei ribosome,N/A
1RY1_0,GGCCGGGCGCGGUGGCGCGCGCCUGUAGUCCCAGCUACUCGGGAGGCUC,2004-04-20,Structure of the signal recognition particle interacting with the elongation-arrested ribosome,N/A
5UH6_0,GA,2017-04-12,Crystal structure of Mycobacterium tuberculosis transcription initiation complex containing 2ntRNA in complex with Rifampin,N/A
4A3J_0,CA,2011-12-07,RNA Polymerase II initial transcribing complex with a 2nt DNA-RNA hybrid and soaked with GMPCPP,N/A
8IP0_0,AGAGCACUUUUAUCACCGUGUCCCCAAUCUGGAUAUUUUGUGUG,2024-03-20,Cryo-EM structure of type I-B Cascade bound to a PAM-containing dsDNA target at 3.6 angstrom resolution,N/A
8AM9_0,GCCGAAGUGGCGAAAUCGGUAGACGCAGUUGAUUCAAAAUCAACCGUGCCGGUUCGAGUCCGGCCUUCGGCACCA,2023-03-08,Cryo-EM structure of the proline-rich antimicrobial peptide drosocin bound to the elongating ribosome,N/A
6B44_0,CUAAGAAAUUCACGGCGGGCUUGAUGUCCGCGUCUACCUGGUUCACUGCCGUGUAGGCAG,2017-10-18,Cryo-EM structure of Type I-F CRISPR crRNA-guided Csy surveillance complex with bound target dsDNA,N/A
6Z9T_0,CACAUUCCAACCACACCUGGCGUGUGGC,2020-11-04,Transcription termination intermediate complex 5,N/A
8GAO_0,CCGA,2023-06-07,bacteriophage T4 stalled primosome with mutant gp41-E227Q,N/A
7LYS_0,ACGAUUGCCCCUCACGAGGGGACAGCUGGUAAUGGGAUACC,2021-08-04,Cryo-EM structure of CasPhi-2 (Cas12j) bound to crRNA and DNA,N/A
1C04_0,GCCAGGAUGUAGGCUUAGAAGCAGCCAUCAUUUAAAGAAAGCGUAAUAGCUCACUGGU,1999-08-31,IDENTIFICATION OF KNOWN PROTEIN AND RNA STRUCTURES IN A 5 A MAP OF THE LARGE RIBOSOMAL SUBUNIT FROM HALOARCULA MARISMORTUI,N/A
7XHT_0,GCGGAUAACAAUUCCCCGGCUCUUCCAACUUAGGUUGAAAGAGCACAGGCUGAGACAUUCGUAAGGCCGAAAGACCGGACGCACCCUGGGAUUUCCCCAGUCCCCGGAACUGCAUAGCGGAUGCCAGUUGAUCAGAUAAGCCAGGGGGAACAAUCACCUCUCGAGAGAGUUUUACAAAA,2022-12-14,Structure of the OgeuIscB-omega RNA-target DNA complex,N/A
6KR6_0,UAUU,2020-02-19,Crystal structure of Drosophila Piwi,N/A
4UJD_0,CCUGUGAGGAACUACUGUCUUCACGCAGAAAGCGUCUAGCCAUGGCGUUAGUAUGAGUGUCGUGCAGCCUCCAGGACCCCCCCUCCCGGGAGAGCCAUAGUGGUCUGCGGAACCGGUGAGUACACCGGAAUGAUUUGGGCGUGCCCCCGCAAGACUGCUAGCCGAGUAGUGUUGGGUCGCGAAAGGCCUUGUGGUACUGCCUGAUAGGGUGCUUGCGAGUGCCCCGGGAGGUCUCGUAGACCGUGCACCAUGAGCACGAAU,2014-07-30,mammalian 80S HCV-IRES initiation complex with eIF5B PRE-like state,N/A
6L5N_0,UUUUUUU,2020-06-17,Crystal structure of human DEAD-box RNA helicase DDX21 at post-unwound state,N/A
7OIF_0,GGUGAGGUGUCCGAGUGCUGAAGGAGCACGCCUGGAAAGUGUGUAUACGGCAACGUAUCGGGGGUCGUAUCCCCCCCUCACCGCCA,2022-01-19,CspA-27 cotranslational folding intermediate 2,N/A
6XWW_0,GGAAAUUAUAUUAAUUUCC,2020-05-27,Constitutive decay element CDE1 from human 3'UTR,N/A
6LQS_0,GUCGACGUACUUCAUAGGAUCAUUUCUAUAGGAAUCGUCACUCUUUGACUCUUCAAAAGAGCCACUGAAUCCAACUUGGUUGAUGAGUCCCAUAACCUUUGUACCCCAGAGUGAGAAAUAGCUUGGCCGAAUCGGUUCGGCCACUAUAUUGCCGUUGCAUUUUAUGGCGCGAUGAUCUUGACCCAUCCUAUCUUCGAAGAUAGGGGGGUGGGUACAAAUGGCAGUCUGACAAGU,2020-09-16,Cryo-EM structure of 90S small subunit preribosomes in transition states (State D),N/A
6LQS_1,UGCGAAAGCAGUUGAAGACAAGUGGCUUGUCGUUCGUUAAUGGCCUCGCAGCGAAGGAUUUGGUGGAUUACUAGCUAAUAGCAAUCUAGGAAACUCAAAGAGUGCUAUGCGGAGUGCGCGAGAGCAUUUCCGGCAGCAGAGAUUUCAGCUGU,2020-09-16,Cryo-EM structure of 90S small subunit preribosomes in transition states (State D),N/A
5FQ5_0,AUAACUCAAUUUGUAAAAAAGUUUUAGAGCUAGAAAUAGCAAGUUAAAAUAAGGCUAGUCCGUUAUCAACUUGAAAAAGUG,2016-03-23,Crystal structure of Cas9-sgRNA-DNA complex solved by native SAD phasing,N/A
8PM4_0,CAACGCCAGCGCGGAGGCGUCAAAUCCGCGACAGUUGACCCAACGUCGCCGG,2024-02-07,Cryo-EM structure of the Cas12m-crRNA-target DNA complex,N/A
8PBL_0,AAUCGAGCGUGUGA,2023-10-25,E. coli RNA polymerase elongation complex stalled at thymine dimer lesion,N/A
6DMN_0,ACAU,2018-08-15,Crystal Structure of Bacillus Halodurans Ribonuclease H1 in Complex with an RNA/DNA Hybrid: Soaked in 2 mM Ca2+ and 200 mM K+ at 21 C,N/A
4BPB_0,GCGCGCGCGC,2013-06-19,STRUCTURAL INSIGHTS INTO RNA RECOGNITION BY RIG-I,N/A
4BPB_1,GCGCGCGCGC,2013-06-19,STRUCTURAL INSIGHTS INTO RNA RECOGNITION BY RIG-I,N/A
7BPF_0,GCUGCG,2020-11-25,Structure of L-threoninol nucleic acid - RNA complex,N/A
8G4S_0,GCCCGGAUAGCUCAGUCGGUAGAGCAGGGGAUUUAAAAUCCCCGUGUCCUUGGUUCGAUUCCGAGUCCGGGCACC,2024-01-31,40S ribosomal subunit of the 80S Giardia intestinalis assemblage A ribosome with Emetine bound in V2 conformation with mRNA and three tRNAs.,N/A
7DUH_0,UUUUUU,2022-01-26,Crystal structure of the Thermus thermophilus (HB8) 30S ribosomal subunit with mRNA and cognate transfer RNA anticodon stem-loop and sisomicin derivative N1''AC bound,N/A
4YCP_0,GCGUAGUUCAAUUGGUAGAGCACCGGUCAAAACCGGGGUGGGAGUUCGAGUCUCUCCGCC,2015-04-22,E. coli dihydrouridine synthase C (DusC) in complex with tRNATrp,N/A
7XFZ_0,GUGAACGGUGGAGCAACACCGCGUGUUCCCCGCAUACGCGGG,2023-08-09,CryoEM structure of type IV-A Csf-crRNAsp14-dsDNA ternary complex,N/A
4HT9_0,UU,2013-04-17,Crystal structure of E coli Hfq bound to two RNAs,N/A
5TKO_0,UAGCUCC,2017-10-11,RNA heptamer duplex with one 2'-5'-linkage,N/A
5TKO_1,GGAGCUA,2017-10-11,RNA heptamer duplex with one 2'-5'-linkage,N/A
4V4P_0,GCGGAUUUAGCUCAGUUGGGAGAGCGCCAGACUGAAGAUCUGGAGGUCCUGUGUUCGAUCCACAGAAUUCGCACCA,2014-07-09,Crystal structure of 70S ribosome with thrS operator and tRNAs.,N/A
8EOF_0,CCGAAGCUUCGGCUUCGGCAGGAGAGGUA,2023-02-01,Mycobacterium tuberculosis transcription elongation complex with Bacillus subtilis NusG (EC_PG),N/A
4PEI_0,ACA,2014-08-27,Dbr1 in complex with synthetic branched RNA analog,N/A
6VYZ_0,UUGAUUUGGUGAGAGG,2020-09-02,"Escherichia coli transcription-translation complex C6 (TTC-C6) containing mRNA with a 21 nt long spacer, NusA, and fMet-tRNAs at E-site and P-site",N/A
3DEG_0,GCGGAUUUACUCAGGGGAGAGCCCAGAUAAAUGGAGUCUGUGCGUCCACAGAAUUCGCACCA,2008-08-19,Complex of elongating Escherichia coli 70S ribosome and EF4(LepA)-GMPPNP,N/A
8PHJ_0,AAAA,2023-12-13,cA4-bound Cami1 in complex with 70S ribosome,N/A
6S0M_0,G,2019-08-28,"Structural and dynamic studies provide insights into specificity and allosteric regulation of Ribonuclease AS, a key enzyme in mycobacterial virulence",N/A
6A5L_0,GGUGUCUUGGG,2018-10-03,"RNA polymerase II elongation complex stalled at SHL(-1) of the nucleosome, with foreign DNA",N/A
8RCS_0,AGGGGCGAGUUCAAGGAGAGCACCGGUUCCAAACCGGGUUUGGGAGCGAGUCUCUCCGCCCCUGCCA,2024-03-06,Escherichia coli paused disome complex (Rotated disome interface class 1),N/A
8PJ9_0,CGCUAAAGAGGAAGAGGACAGUUUUAGAGCUGUGUU,2024-07-10,"Cas9 bound to cognate DNA, Streptococcus thermophilus DGCC 7710 CRISPR3 system",N/A
6IZP_0,GUACUGGAACAUGUUUCAUGUGGAAGUAC,2019-12-25,Solution structure of the complex of naphthyridine carbamate dimer and an RNA with UGGAA-UGGAA pentad,N/A
5BKN_0,AAAA,2021-12-15,Crystallographic structure of a cubic crystal form of STMV (84.5 degree rotation) grown from chloride,N/A
9CPO_0,UCUCCUAAGAAGCUAUUAAAAUCACAGAUU,2024-07-31,Infectious bronchitis virus core polymerase complex,N/A
9CPO_1,AAAAAUCUGUGAUUUUAAUAGCUUCUUAGGAGA,2024-07-31,Infectious bronchitis virus core polymerase complex,N/A
6HPJ_0,AACAAA,2020-11-18,Structure of human SRSF1 RRM1 bound to AACAAA RNA,N/A
7PTK_0,GGGAGAGUACUAUUCAGAUGCAGACCGCAAGUUCAGAGCGGUUUGCAUCUAGGGUACGUUUUCGAACGUAUCCUCCGACUAAGUGUAUUCGUAUACUUAGUGCCUUGUGCCUGCUUCGGCAGGCAUGACCCAAAUGUGCCUUUCGGGGCACAUUUCCGGUCAUCCAAGUUCGCUUGGGUGAUGCGGGCGUAUAGGUUCGUCUAUACGUCCGCGUUUUCCGAGAAGAGGUAACUCGGGAAACCGGUCCACGUGACAAAGGUAGAGUUACGUGGAGGGAGCAGCUGCAAAGGGAUAAUGCAGUUGCUGGCUGGAUGCCAGAACUCACGACUGGCAUCUACGGGGAUGGUGCUCUCCCAAUUCUCCAUUUACCGCCGAAUCGACCCCAACGUGAGAGGGGUCGGUUCCCCGAGCAUAGACCAAUAUCCCAGGUUUAUGCUCCCCAACGCUGGACGAACUACCUACGUCUAGCGUUCCGGCAAAUGAGUCAAUACCUCAGACUUAUUUGCGGUGCCUGAGCCUAAACUGAACAUGGGUUCAGGCAUCUUGGCUCCAGUUCGCUGGAGCCGACGGUAGCGCUGCGUUCGCGCAGUGCUAGGGAGCAUCCGUUUUCGAGCGGAUGCUGGGCGGUUGCCUGUUCGCAGGCAAUCGGGCCUACUCAUGAUUCGUCAUGAGUGGUGACAGCGUGAUGUUCGCAUUACGCUGUCGGGUAGAUGGAGAAUU,2022-10-05,Young conformer of a 6-helix bundle of RNA with clasp,N/A
8FR8_0,GUUACGGCGGUCCAUAGCGGCAGGGAAACGCCCGGUCCCAUCCCGAACCCGGAAGCUAAGCCUGCCAGCGCCGAUGAUACUACCCAUCCGGGUGGAAAAGUAGGACACCGCCGAACAC,2023-05-17,Structure of Mycobacterium smegmatis Rsh bound to a 70S translation initiation complex,N/A
6ERI_0,UCAAACGAGGAAAGGCUUACGGUGGAUACCUAGGCACCCAGAGACGAGGAAGGGCGUAUUAAUCGACGAAAUGCUUCGGGGAGUUGAAAAUAAGCAGAGAUCCGGAGAUUCCCGAAUAGGUCAACCUUUCGAACUUCUGCUGAAUCCAUGGGCAGGCAAGAGACAACCUGGCGAACUGAAACAUCUUAGUAGCCAGAGGAAAAGAAAGCAAAAGCGAUUCCCGUAGUAGCGGCGAGCGAAAUGGGAGCAGCCUAAACCGUGAAAACGGGGUUGUGGGAGAGCAAUACAAGCGUCGUGCUGCUAGGCGAAUCAGUGGAGUGCGGAACCCUAGAUGGUGAAAGUCCAGUAGCCGAAAGCAUCACUAGCUUAUGCUCUGACCCGAGUAGCAUGGGGCACGUGGAAUCCCGUGUGAAUCAGCAAGGACCACCUUGCAAGGCUAAAUACUCCUGGGUGACCGAUAGCGAAGUAGUACCGUGAGGGAAGGGUGAAAAGAACCCCCAUCGGGGAGUGAAAUAGAACAUGAAACCGUAAGCUCUCAAGCAGUGGGAGGGGGACCAGACCCUGACCGCGUGCCUGUUGAAGAAUGAGCCGGCGACUCAUAGGCAGUGGCUUGGUUAAGGGAACCCACCGGAGCCGUAGCGAAAGCGAGUCUUCAUAGGGCAAUUGUCACUGCUUAUGGACCCGAACCUGGGUGAUCUAUCCAUGACCAGGAUGAAGCUUGGGUGAAACUAAGUGGAGGUCCGAACCGACUGAUGUUGAAGAAUCAGCGGAUGAGUUGUGGUUAGGGGUGAAAUGCCACUCGAACCCAGAGCUAGCUGGUUCUCCCCGAAAUGCGUUGAGGCGCAGCAGUUGACUGGACAUCUAGGGGUAAAGCACUGUUUCGGUGCGGGCCGCGGUACCAAAUCGAGGCAAACUCUGAAUACUAGAUAUGACCUCCAAAUAACAGGGGUCAAGGUCGGCCAGUGAGACGAUGGGGGAUAAGCUUCAUCGUCGAGAGGGAAACAGCCCGGAUCACCAGCUAAGGCCCCUAAAUGACCGCUCAGUGAUAAAGGAGGUAGGGGUGCAGAGACAGCCAGGAGGUUUGCCUAGAAGCAGCCACCCUUGAAAGAGUGCGUAAUAGCUCACUGAUCGAGCGCUCUUGCGCCGAAGAUGAACGGGGCUAAGCGGUCUGCCGAAGCUGUGGGAUGUAAAAAAACAUCGGUAGGGGAGCGUUCCGUGUUAGGGAGAAACGCGUGCGUGAGCCGCGUUGGACGAAGCGGAAGCGAGAAUGUCGGCUUGAGUAACGCAAACAUUGGUGAGAAUCCAAUGCCCCGAAAACCUAAGGGUUCCUCCGCAAGGUUCGUCCACGGAGGGUGAGUCAGGGCCUAAGAUCAGGCCGAAAGGCGUAGUCGAUGGACAACAGGUGAAUAUUCCUGUACUACCCCUUGUUGGUCCCGAGGGACGGAGGAGGCUAGGUUAGCCGAAAGAUGGUUAUCGGUUCAAGGACGCAAGGUGACCCGGGUAAGAAGGGGUAGAGAAAAUGCCUCGAGCCAAUGUUCGAGUACCAGGCGCUACGGCGCUGAAGUAACCGAUGCCAUACUCCCAGGAAAAGCUCGAACGACCUUCAACAAAAGGGUACCUGUACCCGAAACCGACACAGGUAGGUAGGUAGAGAAUACCUAGGGGCGCGAGACAACUCUCUCUAAGGAACUCGGCAAAAUAGCCCCGUAACUUCGGGAGAAGGGGUGCCCCCUCACAAAGGGGGUCGAAGUGACCAGGCCCGGGCGACUGUUUACCAAAAACACAGGUCUCCGCAAAGUCGUAAGACCAUGUAUGGGGGCUGACGCCUGCCCAGUGCCGGAAGGUCAAGGAAGUUGGUGACCUGACAGGGGAGCCGGCGACCGAAGCCCCGGUGAACGGCGGCCGUAACUAUAACGGUCCUAAGGUAGCGAAAUUCCUUGUCGGGUAAGUUCCGACCCGCACGAAAGGCGUAACGAUCUGGGCACUGUCUCGGAGAGAGGCUCGGUGAAAUAGACAUGUCUGUGAAGAUGCGGACUACCUGCACCUGGACAGAAAGACCCUAUGAAGCUUUACUGUUCCCUGGGAUUGGCUUAUUCUAACCUUGUGUCAGGACCUACGGGCCAAGGGACAUUCUCAGGUAGACAGUUUCUAUGGGGCGUAGGCCUCCCAAAAGGUAACGGAGGCGUGCAAAGGUUUCCUCGGGCCGGACGGAGAUUGGCCCUCGAGUGCAAAGGCAGAAGGGAGCUUGACUGCAAGACCCACCCGUCGAGCAGGGACGAAAGUCGGCCUUAGUGAUCCGACGGUGCCGAGUGGAAGGGCCGUCGCUCAACGGAUAAAAGUUACUCUAGGGAUAACAGGCUGAUCUUCCCCAAGAGUUCACAUCGACGGGAAGGUUUGGCACCUCGAUGUCGGCUCUUCGCCACCUGGGGCUGUAGUAUGUUCCAAGGGUUGGGCUGUUCGCCCAUUAAAGCGGUACGUGAGCUGGGUUCAGAACGUCGUGAGACAGUUCGGUCCAUAUCCGGUGUGGGCGUUAGAGCAUUGAGAGGACCUUUCCCUAGUACGAGAGGACCGGGAAGGACGCACCUCUGGUGUACCAGUUAUCGUGCCCACGGUAAACGCUGGGUAGCCAAGUGCGGAGCGGAUAACUGCUGAAAGCAUCUAAGUAGUAAGCCCACCCCAAGAUGAGUGCUCUCCUA,2018-04-18,Structure of the chloroplast ribosome with chl-RRF and hibernation-promoting factor,N/A
8GXB_0,GAGCGUUACGUCCGAAAGUCGCAUUGCACUCCGCGACACGGCUCUUUAAAAACAAAAGGA,2023-01-18,Crystal structure of NAD+ -II riboswitch in complex with NAD+,N/A
6UES_0,GGUCAUGAGUGCCAGCGUCAAGCCCCGGCUUGCUGGCCGGCAACCCUCCAACCGCGGUGGGGUGCCCCGGGUGAUGACCAGGUUGAGUAGCCGUGACGGCUACGCGGCAAGCGCGGGUC,2019-12-18,Apo SAM-IV Riboswitch,N/A
8FKW_0,GCCGAUCAAUCGCCCCCGGGGUGCGCGGCUGGGGGCUCGCAGGGCCCCUCCGUCCCCCUAAGCGCAGAC,2023-07-12,Human nucleolar pre-60S ribosomal subunit (State D2),N/A
5NEW_0,UU,2017-10-04,RNA-RNA base stacking in the crystal structure of an Hfq6:RNA dimer,N/A
8I0W_0,GGAACCGGCCUCCGAACG,2024-07-31,The cryo-EM structure of human C complex,N/A
6KL9_0,AAUUUCUACUAAGUGUAGAUCGGUC,2019-09-11,Structure of LbCas12a-crRNA complex bound to AcrVA4 (form A complex),N/A
7EVO_0,GCCGGCUAAGAUCAAGUGUAGUAUCUGUUCUUAUCAGUUUAAUAUCUGAUUCCUCGAGGAGGAUUUUUGGAGCAGGGAGAUGGAAUAGGAGCUUGCUCCGUCCACUCCACGCAUCGACCUGGUAUUGCAGUACCUCCAGGAACGGUGC,2022-08-03,The cryo-EM structure of the human 17S U2 snRNP,N/A
9BCT_0,UCUUAUUUUUUUUCUAUUUUGCGCCGACC,2024-07-31,Cryo-EM structure of Thermococcus kodakarensis FttA-dependent transcription pre-termination complex containing 44 nt RNA,N/A
7L6T_0,UU,2021-01-06,"Crystal Structure of SARS-CoV-2 Nsp16/10 Heterodimer in Complex with (m7GpppA2m)pUpUpApApA (Cap-1), S-Adenosyl-L-homocysteine (SAH) and two Magnesium (Mg) ions.",N/A
2HEM_0,GGGAAGGCGCUUCGGCGUCGGCCC,2006-09-12,NMR structure and Mg2+ binding of an RNA segment that underlies the L7/L12 stalk in the E.coli 50S ribosomal subunit.,N/A
3X1L_0,AUUGAAAGUUGUAGUAUGCGGUCCUUGCGGCU,2015-05-13,Crystal Structure of the CRISPR-Cas RNA Silencing Cmr Complex Bound to a Target Analog,N/A
4QLM_0,AUCGCUGAACGCGGGGGACCCAGGGGGCGAAUCUCUUCCGAAAGGAAGAGUAGGGUUACUCCUUCGACCCGAGCCCGUCAGCUAACCUCGCAAGCGUCCGAAGGAGAA,2014-08-13,ydao riboswitch binding to c-di-AMP,N/A
6OZP_0,CC?A,2019-09-04,Crystal structure of Mus musculus (Mm) Endonuclease V in complex with a 23mer RNA oligo containing an inosine after a 180 min soak in 10 mM Mn2+,N/A
6JC3_0,UUUUUU,2019-08-07,The Cryo-EM structure of nucleoprotein-RNA complex of Newcastle disease virus,N/A
2VOP_0,AUUUU,2008-05-06,Crystal structure of N-terminal domains of Human La protein complexed with RNA oligomer AUUUU,N/A
7LJ3_0,UCCCUGGUGGUCUAGUGGUUAGGAUUCGGCGCUCUCACCGCCGCGGCCCGGGUUCGAUUCCCGGUCAGGGAACCA,2021-11-17,"Structure of human transfer RNA visualized in the cytomegalovirus, a DNA virus",N/A
1QZC_0,,2003-11-04,"Coordinates of S12, SH44, LH69 and SRL separately fitted into the cryo-EM map of EF-Tu ternary complex (GDP.Kirromycin) bound 70S ribosome",N/A
6HYU_0,AAAAAA,2019-08-28,Crystal structure of DHX8 helicase bound to single stranded poly-adenine RNA,N/A
4V4R_0,GCGGAUUUAGCUCAGUUGGGAGAGCGCCAGACUGAAGAUCUGGAGGUCCUGUGUUCGAUCCACAGAAUUCGCACCA,2014-07-09,Crystal structure of the whole ribosomal complex.,N/A
7ML4_0,GAGGA,2022-02-02,RNA polymerase II initially transcribing complex (ITC),N/A
1LMV_0,GGUGUAGUA,2002-11-27,Solution structure of the unmodified U2 snRNA-intron branch site helix from S. cerevisiae,N/A
1LMV_1,UACUAACACC,2002-11-27,Solution structure of the unmodified U2 snRNA-intron branch site helix from S. cerevisiae,N/A
6QCW_0,GAAUGCUAUAAUAG,2019-06-05,Crystal structure of influenza B polymerase initiation state with capped 14-mer RNA primer,N/A
6QCW_1,UAUACCUCUGCUUCUGCUAUU,2019-06-05,Crystal structure of influenza B polymerase initiation state with capped 14-mer RNA primer,N/A
6QCW_2,AGUAGUAACAAGAG,2019-06-05,Crystal structure of influenza B polymerase initiation state with capped 14-mer RNA primer,N/A
6KOO_0,CCCUCGA,2020-03-11,Mycobacterium tuberculosis initial transcription complex comprising sigma H and 5'-OH RNA of 7 nt,N/A
8ACB_0,UUUUU,2023-05-17,CryoEM structure of sweet potato feathery mottle virus VLP,N/A
8IP8_0,CCA,2024-02-21,Wheat 80S ribosome stalled on AUG-Stop boron dependently,N/A
2MKN_0,GCCGUGGUCUGGUGGCCGG,2014-03-19,Structural Characterization of Interactions between the Double-Stranded RNA-Binding Zinc Finger Protein JAZ and dsRNA,N/A
2MKN_1,CCGGCCACCAGACCACGGC,2014-03-19,Structural Characterization of Interactions between the Double-Stranded RNA-Binding Zinc Finger Protein JAZ and dsRNA,N/A
8FFI_0,UGACGGCUCUAAUCUAUUAGU,2023-08-23,Structure of tetramerized MapSPARTA upon guide RNA-mediated target DNA binding,N/A
7YFE_0,GCU,2023-03-29,In situ structure of polymerase complex of mammalian reovirus in virion,N/A
7YFE_1,AUCGU,2023-03-29,In situ structure of polymerase complex of mammalian reovirus in virion,N/A
7YFE_2,ACGAUUAGC,2023-03-29,In situ structure of polymerase complex of mammalian reovirus in virion,N/A
4JXZ_0,GGGGUAUCGCCAAGCGGUAAGGCACCGGUUUUUGAUACCGGCCGCAGGUUCGAAUCCUGCUACCCCAGCCA,2013-05-01,Structure of E. coli glutaminyl-tRNA synthetase bound to ATP and a tRNA(Gln) acceptor containing a UUG anticodon,N/A
4UYK_0,GGGGCUAGGCCGGGGGGUUCGGCGUCCCCUGUAACCGGAAACCGCCGAUAUGCCGGGGCCGAAGCCCGAGGGGCGGUUCCCGAAGCCGCCUCUGUAAGGAGGCGGUGGAGGGUUCCCACCCUCGGGCGUGCCU,2014-11-05,Crystal structure of a Signal Recognition Particle Alu domain in the elongation arrest conformation,N/A
7CGK_0,UGUAAAUA,2021-07-07,Crystal Structure of PUF-8 in Complex with PBE-RNA,N/A
5AOR_0,UUUUUUUUUU,2015-11-18,Structure of MLE RNA ADP AlF4 complex,N/A
7LIU_0,GGGCGGGDCDCDCDGDCDCDC,2022-08-24,DDX3X bound to ATP analog and remodeled RNA:DNA hybrid,N/A
8J7R_0,GGCUGAAGGAUGCCCAGAAGGUACCCCAUUGUAUGGGAUCUGAUCUGGGGCCUCGGUGCACAUGCAUGUGUAGUCGAGGUUAAAAAACGUCUAGGCC,2023-08-02,Cryo-EM structure of the J-K-St region of EMCV IRES in complex with eIF4G-HEAT1 and eIF4A (J-K-St/eIF4G focused),N/A
8Q4O_0,CGGUAGCGGGUAUGGGUCCGGGU,2024-03-06,RNA G-quadruplex from the 5'-UTR of human tyrosine kinase 2 (TYK2),N/A
8QZ8_0,CACAAAUCA,2023-12-27,Tilapia Lake Virus polymerase in vRNA pre-termination state (transcriptase conformation),N/A
4YHW_0,AUCCUUAUGCACGGGAA,2015-07-22,Yeast Prp3 (296-469) in complex with fragment of U4/U6 di-snRNA,N/A
4YHW_1,UUCCCCUGCAUAAGGAUGAACCGUUUU,2015-07-22,Yeast Prp3 (296-469) in complex with fragment of U4/U6 di-snRNA,N/A
8FR8_0,GUUACGGCGGUCCAUAGCGGCAGGGAAACGCCCGGUCCCAUCCCGAACCCGGAAGCUAAGCCUGCCAGCGCCGAUGAUACUACCCAUCCGGGUGGAAAAGUAGGACACCGCCGAACAC,2023-05-17,Structure of Mycobacterium smegmatis Rsh bound to a 70S translation initiation complex,N/A
8JIV_0,GGAUGCGAUCAUACCAGCACUAAGGCAUCGGAUCCCGUCAGAACUCCGAAGUUAAGCGUGCUUGGGCGAGAGUAGUACAAGGAUGGGUGACCUCUUGGGAAGUCCUCGUGUUGCAUUCC,2024-03-27,Atomic structure of wheat ribosome reveals unique features of the plant ribosomes,N/A
9GCH_0,UAAAUAUAGUUUAAAAACAUCAGAUUGUGAAUCUGACAACAGAGGCUUACGACCCCUUAUUUACCCC,2024-11-20,"Human mitochondrial RNase Z with tRNA-His-CCA, SDR5C1/TRMT10C focus",N/A
7V01_0,ACGAGAACACGUAUGCCGAAGUAUAUAAAU,2022-07-06,Staphylococcus epidermidis RP62a CRISPR short effector complex with self RNA target and ATP,N/A
7V01_1,AUUUAUAUACUUCGGCUACGUGUUC,2022-07-06,Staphylococcus epidermidis RP62a CRISPR short effector complex with self RNA target and ATP,N/A
8FJL_0,UAUAUAUAUAUAUAUAUAUAUAUAUAUAUAUAUAUAUAUAUAUAUAUAUAUAUAUAUAUA,2023-03-08,Golden Shiner Reovirus Core Tropical Vertex,N/A
8FJL_1,UAUAUAUAUAUAUAUAUAUAUAUAUAUAUAUAUAUAUAUAUAUAUAUAUAUAUAUAUAUA,2023-03-08,Golden Shiner Reovirus Core Tropical Vertex,N/A
6JJH_0,GGCUCGGCGGCGGA,2020-02-26,Crystal structure of a two-quartet RNA parallel G-quadruplex complexed with the porphyrin TMPyP4,N/A
6ASX_0,CCUGAUCAGGCGAUGUGUGCU,2018-03-28,CryoEM structure of E.coli his pause elongation complex,N/A
3JBU_0,GCUGGCCCUCA,2016-01-27,Mechanisms of Ribosome Stalling by SecM at Multiple Elongation Steps,N/A
8WFX_0,ACGGAAACUUAAAACCGUGUUGCACUGCAACCCGGAAUUCUUGCACGUCG,2024-07-31,Cryo-EM structure of CRISPR-Csm effector complex from Mycobacterium canettii,N/A
5XXU_0,AACCUGGUUGAUCCUGCCAGUAGUCAUAUGCUUGUCUUAAAGAUUAAGCCAUGCAUGUCUAAGUAUAAGCUUUUAUACGGCUAAACUGCGAAUGGCUCAUUAAAACAGUUAUAGUUUAUUUGAUGGUCUACAUGGAUAACCGUGGUAAUUCUAUGGCUAAUACCUGCGCACAGUGUUUAUUAGAUACAGAACCAAGGUGAUUCAUAGUAACCGAACGGAUCGCGCUGCGACGGAUCAUUCAAGUUUCUGACCUAUCAGCUUUCGACGGUACUGUAAUGGACUACCGUGGCAGUGACGGGUAACGGGGAAUUAGGGUUCGAUUCCGGAGAGGGAGCCUGAGAAACGGCUACCACAUCUAAGGAAGGCAGCAGGCGCGCAAAUUACCCAAUCCUGAUUCAGGGAGGUAGUGACAAGAAAUAACAACCUGGAGUGAUUGGAUGAUAGGAAUCCAAACCCCUUUCAGAGUAACAAUUGGAGGGCAAGUCUGGUGCCAGCAGCCGCGGUAAUUCCAGCUCCAAUAGCGUAUAUUAAAGUUGUUGCAGUUAAAAAGCUCGUAGUUGGAUUUCUGCUGGAAGGCCAAUUCUAGCAUCCUUCUGGACUUUUACUUUGAGAAAAUUAGAGUGUUUCAAGCAGGCUUGUCGCCUUGAAUACUCAGCAUGGAAUAAUAAGAUUUCGGCCCUAUUUUGGUUUCUAGGACUGAAGUAAUGAUUAAUAGGGACGGUUGGGGGCAUUCGUAUUUAACUGUCAGAGGUGAAAUUCUUAGAUUUGUUAAAGACGAACUACUGCGAAAGCAUUUGCCAAAGAUGUUUUCAUUAAUCAAGAACGAAAGUUAGGGGCUCGAAGACGAUCAGAUACCGUCGUAGUCUUAACCAUAAACUAUGCCGACUAGAGAUAGGAAAACGUCAUGACUUCUCCUGCACCUUAUGAGAAACCAAAGUCUUUGGGUUCUGGGGGGAGUAUGGUCGCAAGGCUGAAACUUAAAGGAAUUGACGGAAGGGCACCACCAGGCGUGGAGCCUGCGGCUUAAUUUGACUCAACACGGGGAAACUCACCAGGUCCAGACAUAGGAAUUGACAGAUUGAUAGCUCUUUCUUGAUUCUAUGGGUGGUGGUGCAUGGCCGUUCUUAGUUGGUGGAGUGAUUUGUCUGGUUAAUUCCGUUAACGAACGAGACCUUAACCUGCUAAAUAGGAUCAGGAACUUCGUGUUCUUGUAUCACUUCUUAGAGGGACUUUGCGUGUCUAACGCAAGGAAGUUUGAGGCAAUAACAGGUCUGUGAUGCCCUUAGAUGUUCUGGGCUGCACGCGCGCUACACUGAUGCAUCCAACGAGUCCUUGGCCGAUAGGUCUAGGUAAUCUUGUGAGUAUGCAUCGUGAUGGGGAUAGAUUAUUGCAAUUAUUAAUCUUCAACGAGGAAUGCCUAGUAGGCGCAAGUCAGCACGUUGCGCCGAUUACGUCCCUGCCCUUUGUACACACCGCCCGUCGCUCCUACCGAUUGAGUGUUCCGGUGAAUUAUUCGGACCGUUUUGUGGCCCGAAAUGGGAAGUUUUGUGAACCUUAACACUUAGAGGAAGGAGAAGUCGUAACAAGGUUUCCGUAGGUGAACCUGCGGAAGGAUCAUU,2017-08-30,Small subunit of Toxoplasma gondii ribosome,N/A
7QIZ_0,UACCUGGUUGAUCCUGCCAGUAGUCAUUGCUUGUCUAAAGAUUAAGCCAUGCAUGUGUAAGUAUGAACAAAUAGACUGUGAAACUGCGAAUGGCUCAUAAAUCAGUAUAGUUUGUGAUGGUUACUGGAUAACCGUAGUAAUUCUAGGCUAAUACGUGCACCCCGAAAGGGAUGCAUUUAUAGAUAGCAUGAUUCAGAAACUCGACGGAUCGCACGGCCGCCGGCGACGCAUCAUCAAAUUCUGCCCUAUCAACUUUCGAUGGUAGGAUAGUGGCCUACCAUGGUGGUGACGGGGACGGAGAAUUAGGGUUCGAUCCGGAGAGGAGCCUGAGAAACGGCUACCACAUCAAGGAAGGCAGCAGGCGCGCAAUUACCCAACCUGACACGGGGAGGUGUGAAAUAAAUAACAAUACCGGGAGUCUGGUAAUUGGAAUGAGUACAAUCUAAAUCCCUUAACGAGGUCCAUUGGAGGGCAAGUCUGGUGCCAGCAGCCGCGGAAUCCAGCUCCAAUACGUAAUUAAGUUGUGCAGUUAAAAGCUCGUAGUGGACUUUGUGUUACUUGAAGAAAUAGAGUGCUCAAAGCAAGCCUACGCUCUGUAUACAUUGCAUGGGAAACAUUAUAGGAUUUCGGUCCUAUGGGAUCGGAGUAAUGAUUAACAGGGACAGUCGGGGGCAUUCGUAUUUCAUAGUCAGAGGUGAAAUCUUGGAUUUAUGAAAGACGAACAACUGCGAAAGCAUGCCAAGGAUGUUUUCAUUAAUCAAGACGAAAGUUGGGGGCUCGAAGACGACAGAUACCGCCUAGUCUCAACCAAAACGAUGCCGACCAGGGAUCGGCGGAUGUUGCUAGGACUCCGCCGGCACCUUAUGAGAAAUCAAAGUUUUUGGGUCCGGGGGGAGUAGGUCGCAAGGCUGAAACUUAAAGGAAUUGACGGAAGGGCACCACCAGGAGUGGAGCCGCGGCUAAUUGACCAACACGGGGAAACUACCAGGCAGACAUAGUAGACUGAGAGCUCUUUCAGGGUGGGUGCAUGGCGUUCUUAGUGGUGGAGCGAUUGCUGGUAAUUCCGUUAACGACGAGACCUCAGCCUGCUAACUAGCUAUGCGGAGGUUCCCUUCGCGGCCAGCUCUUAGAGGGACUACGGCCUUUUAGGCCGCGGAAGUUUGAGGCAAUAACAGUCUGUGAUGCCCUAGAUGUUCUGGGCCGCACGCGCGCUACACUGAUGUAUCAACGAGCUUAUAGCCUUGGCCGACAGGCCCGGGUAAUCUUUGAAAUUCACGUGAUGGGGAUAGAUCAUUGCAAUUGUGGUCUUCAACGGAAUUCCUAGUAAGCGCGAGUCAUCAGCUCGCGUUGACUACGUCCCUGCCCUUGUACACACCGCCGUCGCUCCUACCGAUUGAAUGAUCCGGUGAAAUGUUCGGAUCGCGGUCGCGAGAAGUCCAUUGAACCUUAUCAUUUAGAGGAGGAGAAGUCGUACAAGGUUUCGUAGGUGCCUGCGGAAGGAUCAUUG,2022-08-03,Specific features and methylation sites of a plant 80S ribosome,N/A
6PMO_0,GCGGAAGUAGUUCAGUGGUAGAACACCACCAAGGUGGGGGUCGCGGGUUCGAAUCCCGUCUUCCGCUCCA,2019-11-20,Co-crystal structure of the Geobacillus kaustophilus glyQ T-box riboswitch discriminator domain in complex with tRNA-Gly,N/A
7ELA_0,CUGUGCG,2021-05-05,Structure of Lassa virus polymerase in complex with 3'-vRNA and Z mutant (F36A),N/A
8QUE_0,AGACAG,2024-07-31,Structure of the Bacteriophage PhiKZ non-virion RNA Polymerase bound to DNA and RNA,N/A
8URB_0,AGCUAUUAAAAUCACAGAUU,2023-11-15,Porcine epidemic diarrhea virus complete core polymerase complex,N/A
8URB_1,AAAAAUCUGUGAUUUUAAUAG,2023-11-15,Porcine epidemic diarrhea virus complete core polymerase complex,N/A
7WWV_0,UUAAAGAGUCAACCCUUUGCUUAUCUUCCCUAUUUAAAU,2023-04-26,DNA bound-ICP1 Csy complex,N/A
7WAZ_0,GGCGCGUUUAUUCCAUUACUUUGGAGCCAGUCCCAGCGACUAUGUCGUAUGGACGAAGCGCUUAUUUAUCGGCCGAUAAGUAAAACGCAUCAAAGUCCUGCAGCAGAAAAUCAAA,2022-03-16,PlmCasX-sgRNAv1-dsDNA ternary complex at ts loading state,N/A
