target_id,sequence,temporal_cutoff,description,all_sequences
3J79_0,GAUGUUAGGAGGGCAAAUCCGCCGAAUUUAAGCAUAUAAUUAAGCGGAAGAAAAGAAAAUAACUAUGAUUCCUUUAGUAACGGCGAGUGAACAAGGACCAGCUCAAACGGUUAAUCCUUCGUUUGGUGCAAACCUUUCGACGGAAUUGUCGUUGAAUUAUUCCAUGAAUGCCUUUAAUUUGAGCAAAGUGAGCAGGAAUGCUUCCCCAUAGAGGGUGAAAGGCCCAUAGUUCUUUUUAAUUUAUUCAUUGGAAUUUUUCAUGUCGAGUCGUGUUCUUUGAGAUUGGAGCACUAAUACGUGUGAUACAUUUCACAUAAAGCUAAAUAUAUGUAGGAGACCGAUAGCAAACAAGUACCGUGAGGGAAAGAUGAAAUAGUACUCAGGAAUGAGCAAUUAAAUAGUACCUGAAAUCGUUAAGAUGGAACGGAUUAAGAGAGAAAACAAGUAAAGAGGGGAAUAUUCUCUUCUUUAUUAAAAGAAACAUCAGUGAUUAAUUUAAUUUCAAUAAAGCAAUCCCCUGAAAUUGUUUUCACUUUCUCCCCGCACUAAUGUGGGGAAAACUGGCUUUAUUUCUUCAAUUAUUUUUUUUGCUGAGGAAUUUUAAAAUUAUUUGAAUUUUUCUUCUUAUAAUUUAAGUUGUUUCUAUACAGUACUUUCUUAACCCACUCGUCUUGAAACACGGACCAAGGAGUCUAGCAAAUGUGCAAGUGUAUAUGAUUCUUUAAACAUUUUACGCAUAAUUAAUGUAAUAUGUCCAUUGUAGAUUUGUGCCCCACUUUGCAUACAAUACCGGUAAGCAAAUGCUUUAUUGAGUACGAGCAUAUUUGGUAGGACCCGAGAGGCUUUGAACUAAGCGUGAUGAGAUUGAAGUCAGACGAAAGUCUGAUGGAGGAUCGAGUUGAUACUGACGUGCAAAUCGUUCAUUUCAAUCACGUUUAGGGGCGAAAGACUAAUCGAAAAGCCUAUUAGCUGGUUAUUUUCGAAAGAUCUCUCAGGAUCGCUGGAGUUGAUUAAUAUAAUUUUACCAGGUAGAGAUAAUGAUUAGAGGACAGGGCCUUGACCUAUUCUCAAACUCCCAAUAGGUAAAAAGGGCGAAAUAACUCAAUUUGUAUUUCACUCAUAUUAAAUAAAAUAACUCCAAGUGGGCCAUUUUUGGUAAGCAGAACUGGCGAUGAGGGAUGCUCCUAACGCUUGGAUAAGGUGCCUAAAUAUUCGCUCAUGAGAUCCCAUAAAAGGUGUUGGUUCAUAUGAACUAGCCCUGAAAAUGGAUGGCGCUAAAGCGGAUUACCGAUACCAAGCCAUAAAAAGAAGAAAAAAUUUUUUUUUAGAAUCUUUUUAUGAGUAGAAAAUCGUGGGGUUUGUGUUGAAGCGAAAUACGUGAGUUUUCGUGGAACAUCUCCCUAGUGCAGAUCUUGGUGGAAGUAGCAACUAUUCAAAUGAGAACUUUGAAGACUGAAGUGGAGAAGGGUUUCUUGUCAACUGUGAUUGAACAAGAGUUAGCCGCUCCUAAGGGAUAGCUGAAAAGUGUUUAAAGGGGUCCCCGUCUCAAAAGGGAAACAGGUUGAUAUUCCUGUGCCAAUAGUAUUAUGAGUUAGAUGGUAACAUAUAUAUAAAUGAACUCCUUUACAUAGGCUUUACACUCGGGGUGCGUUUUCUUUGCACUUUACCUUUAUAACAAACCUUGGAAUCAAUUUACUUGGAGAAGAGGUUCGUUGAACUCAAUUCAAAAAUUUGUUUUGUAGCAAUAGUAAUUCGUAAUUAUCCGAAGUGGUAAGGACUAUCCUUGAAAAAAGGAGGGAACGGCUUUGUGCUUUGCUACUCUUAAUACUUGUAUGAGCGUACCAACAACCGCAUCAGGUCUCCAAGGUUAACAGCCUCUGGUUAAAUAGAAAAAAGUAGGUAAGGGAAGUCGGCAAAAUAGAUCCGUAACUUCGGGAAAAGGAUUGGCUCUGAGGACAUUAAUGUUAACUCAGAACUGAAACGGACAAGGGGAAUCCGACUGUUUAAUUAAAACAUAGCAUUGUGAAAAGCCACAACUGGUAUUAACACAAUGUGAUUUCUGCCCAGUGCUUUGAAUGUCAACUUGAUGAAAUUCAAUCAAGCGCAGGUAAACGGCGGGAGUAACUAUGACUCUCUUAAGGUAGCCAAAUGCCUCGUCAUCUAAUUAGUGACGCGCAUGAAUGGAUUAACGAGAUUCCCACUGUCCCUACUUGCUAUCUAGCGAAACCACAGCCAAGGGAACGGGCUUGGCAAAAUCAGCGGGGAAAGAAGACCCUGUUGAGCUUUACUCUAGUCUGGCUUUGUGAAACGACUUAAGAGGUGCUACUUUUAAAGUUGUUUUACUUAUCCAUUUAUAGGGAUGAAUUUCCCAAUAUGGAGACAUAGCCAGGUGGGGAGUUUGACUGGGGCGGUACAUCUGUUAAAUAUUAACGCAGAUGUCCAAAGACAAGCUCAAAGAGAACAGAAAUCUCUUGUAGACUAAAAGGGGAAAAGCUUGUUUGAUUUCUAUUUUCAGAACAAGUAGAAAACGUGAAAGCGUGGCCUAUCGAUCCUUUAUAUUUGCAAAAUGACGUAAAUUACUUACUACUGUGCAUAUAGAGGUGUCUGAAAAGUUACCACAGGGAUAACUGGCUUGUGGCUGCCAAGCGCUCCUAGCGACGUAGCUUUUUGAUCCUUCGAUGUCGGCUCUUCCUAUCAUUGGGACGCAGAAGUCUCAAAGUGUCGGAUUGUUCACCCGCUAAUAGGGAACGUGAGCUGGGUUUAGACCGUCGUGAGACAGGUUAGUUUUACCCUACUGAUGAAUUUUAUUAUAUAUAUACAUAUAGUAUUGUGACAGUAAUCCAACUUGGUACGAGAGGAUUAGUUGGUUCAGACAAUUGGUACAGCAAUUGGUUGACAAACCAGUGUUGCGAAGCUAAGUCUGUUGGAUAAUGGCUGAACGCCUCUUAAGCCAGAAACCAUGCUGAUUAAACAAUACUAUCUUUUUUGUUUGCUAAUGUAAAAGAGAAAUUAUAUAUGUACCGGUACAUAAAUAAUCCUAUCACCUUUUUCGUGGCUAGCUGUGAGCUAGGCAAUAGUUCUUUAACAACAAAAAAGAGCACAAACUGUAGACGACUUUUUUGCCUCAGGGUGCUGUAAACAUGAAAGUAAACUUUACGAUCUGUUGAGGCUUAUCCCUAGUGGUAAAGUGU,2014-07-16,"Cryo-EM structure of the Plasmodium falciparum 80S ribosome bound to the anti-protozoan drug emetine, large subunit",N/A
3J79_1,AGCACAGUCUUAACGAUGGAUGUCUUGGUUCCUACAGCGAUGAAGGCCGCAGCAAAAUGCGAUACGCAAUGAAAAUUGCAGUGACUGAAUCAUCAGAAUGCUGAAUGUAAACUACACCAAUUCCCUGGGAAUAGUGGUACUCCUACAGAAA,2014-07-16,"Cryo-EM structure of the Plasmodium falciparum 80S ribosome bound to the anti-protozoan drug emetine, large subunit",N/A
5T3K_0,GGUGGUGAAGUCGCUGG,2017-07-05,Fluorescence detection of RNA-ligand binding and crystal structure determination of ribosomal decoding site RNA using a heavy atom containing fluorescent ribonucleoside,N/A
5T3K_1,CAGCGCACACCACCC,2017-07-05,Fluorescence detection of RNA-ligand binding and crystal structure determination of ribosomal decoding site RNA using a heavy atom containing fluorescent ribonucleoside,N/A
2LUB_0,GGGUGAAACGGAGGACUUCGGUCCUCAAGUUUCACCC,2012-07-25,High resolution NMR solution structure of helix H1 of the human HAR1 RNA,N/A
8TSV_0,CAGACUGCGAGGGCCCUCGAGUUUG,2024-03-06,Crystal structure of the Zika virus stem-loop A (SLA) top stem,N/A
8TSV_1,CAGACUGCGAGGGCCCUCGAGUUUG,2024-03-06,Crystal structure of the Zika virus stem-loop A (SLA) top stem,N/A
1E8O_0,GGCCGGGCGCGGUGGCGCGCGCCUGUAGUCCCAGCUACUCGGGAGGCUC,2000-11-08,Core of the Alu domain of the mammalian SRP,N/A
8AZW_0,GGAUGCGAUCAUACCAGCACUAACGCACCGGAUCCCAUCAGAACUCCGAAGUUAAGCGUGCUUGGGCGAGAGUAGUACUAGGAUGGGUGACCCCCUGGGAAGUCCUCGUGUUGCAUCCC,2023-06-07,Cryo-EM structure of the plant 60S subunit,N/A
8HKE_0,GGGCAAUGUGACUGCAUCAGCAGUCACAUUGCCCAAG,2023-11-29,dsRNA transporter,N/A
8HKE_1,CUUGGGCAAUGUGACUGCUGAUGCAGUCACAUUGCCC,2023-11-29,dsRNA transporter,N/A
8I88_0,GA,2023-07-05,Cryo-EM structure of TIR-APAZ/Ago-gRNA complex,N/A
6TYG_0,CACCCUCGA,2020-03-11,Crystal structure of MTB sigma L transcription initiation complex with 9 nt long RNA primer,N/A
7YPW_0,UUUUUU,2023-04-19,Lloviu cuevavirus nucleoprotein-RNA complex,N/A
6FPX_0,UUUAAACCUA,2018-05-09,Structure of S. pombe Mmi1 in complex with 11-mer RNA,N/A
8FRU_0,AGUUCGGCCAUCCUACGGCGGAAACUCCUUAACUCGUUCCGAAUUAAGAAGAGAAGCGCCGUCAGGCCCCGCCAGUACUGCGAUCGGAGACGUCGUGGGAACACGGGGUGCCGAACU,2024-01-31,60S subunit of the Giardia lamblia 80S ribosome,N/A
6ZJ3_0,UCGCUGGUGGUUGGGCUGGGGGGUGUGCGGCUGCACCGGGGGCUGCACCGUACGGUGGUCCCCUUGCUGGCUGCACCGUCCCCCAGCCUGACCCCAGUGAGAAAUUGGCAGCAGAGCUUGGCACGCAGUGCUGCUCUCUGCCCGUCUCGAACGACCAAGGAGUUAAGGAGCUUGCCAGUCGGAUGGCUUCCAAAACCUUGAGGCGUGGUGAAGGCAACUAUCCUUCCAGAGGGGCUAGUCUCUGCUGGAACGACCGGACCCGAAGUCCAGUGGACAGGGUUCGAGGCUUGCAAGGUCCUUGGGACCCAAGGUGGUGAACAUCCGUCUACGGUGAAGCCAUGGGAAACUGUGGUGGAAGCCGGUGCUGUCUGACGUGCAAAGUGAGCCUGAGGCGCUAGGGUGAAAGCAACGAGCCACCUAGAGCUGGUUCCCUUCGAAGUUUCCCCAGGAAGCGGGAUCCAAUGAUGCAAAGUGUGACUGGUUGCAUCGGAAAGCAACCAUGAGAGGCUGGGGAGCUCCUCAACCACCUCGAACUGUGAAUGGGUGCGGACAGGCAUGCUUCUUGCCACGACAGGAGGCUGUGUAACAGCAGUUCUCCCCGUCUUCGAGCAUGUU,2020-10-07,Cryo-EM structure of the highly atypical cytoplasmic ribosome of Euglena gracilis,N/A
7TZS_0,GACUCGGGGUGCCCUUCUGCGUGAAGGCUGAGAAAUACCCGUAUCACCUGAUCUGGAUAAUGCCAGCGUAGGGAAGUU,2022-05-25,Crystal structure of the E. coli thiM riboswitch in complex with quinoxalin-6-ylmethanamine (compound 17),N/A
8VAW_0,ACUUAAGUCG,2024-04-17,Magnesium catalyzed primer extension product with 14mer primer and mixed phosphorothioate activated G monomer,N/A
8VAW_1,ACUUAAGUCG,2024-04-17,Magnesium catalyzed primer extension product with 14mer primer and mixed phosphorothioate activated G monomer,N/A
8FRU_0,AACGCCCCGCCGGCGGAUGCCUCGGCCCGGGCGGCGACGAAGAGCGCGGCGGAGCGCGAGACGCGGUGCGGACCCGCCCGCCCCGAGAAGCACCGGCCCUCGAACGCAGCGCGCCCCGGCGCCGCCGCCUCGGUGCCCUGC,2024-01-31,60S subunit of the Giardia lamblia 80S ribosome,N/A
8R57_0,GGCACCACCAGGCGUGGAGCCGCGGCUUAAUUGACUCAACACGGGGAAACUUACCAGGCAGACAUAGCAAGGAUGACAGACUGAGAGCUCUUUCUUGAUUCAGGGUGGGUGCAUGGCGUUCUUAGUUGGUAAUUCCGUUAACGACGAGACUCAGCCUGCUAACUAGCUAUGCGGAGCCAUCCCCGCAGCUAGCUCUUAGAGGGACUAUCGCCGUUAGGCGACGGAAGUUUGAGGCAAUAACAGUCUGGAUGCCCUAGAUGUUCUGGGCCGCACGCGCGCUACACGAUGUAUUCAACGAGUAUAUAGCCUUGGCCGACAGGCCCGGGUAAUCUUGGGAAAUCAUCGUGAUGGGGAUAGAUCAUUGCAAUUGUGGUCUUCAACGGAAUGCCUAGUAAGCGCGAGUCACAGCCGCGUGACUACGUCCCUGCC,2023-12-27,"CryoEM structure of wheat 40S ribosomal subunit, head domain",N/A
5TF6_0,GGUCAAUUUGAAACAAUACAGAGAUGAUCAGCAGUUCCCCUGCAUAAGGAUGAACCGUUUUACAAAGAGAC,2017-01-11,Structure and conformational plasticity of the U6 small nuclear ribonucleoprotein core,N/A
8D28_0,GGCGAUACCAGCCGAAAGGCCCUUGGCAGCGCC,2022-11-30,Crystal structure of theophylline aptamer in complex with theophylline,N/A
5I9F_0,UUUUUUUUUU,2016-04-27,Crystal structure of designed pentatricopeptide repeat protein dPPR-U10 in complex with its target RNA U10,N/A
8SCB_0,CAAAGUUUAAG,2023-12-27,Terminating ribosome with SRI-41315,N/A
6U6Y_0,CGC,2020-09-02,Human SAMHD1 bound to ribo(CGCCU)-oligonucleotide,N/A
5LTA_0,UUUUUUU,2017-01-25,Crystal structure of the Prp43-ADP-BeF3-U7-RNA complex,N/A
8T29_0,GGUUGCUCGACUGUGAGGGGACCUACCCACUGUGGAAACACCACAGGAACUUCCAACCUUCGGGUGGCGAGGUAGGGCAGAAGAGUGACC,2024-01-10,Crystal structure of SCV PTE RNA in complex with Fab BL3-6,N/A
8EHF_0,GAUGUGUGCU,2023-03-01,Cryo-EM structure of his-elemental paused elongation complex with an unfolded TL (1),N/A
5ZSE_0,GUCCC,2019-01-30,Crystal structure of monkey TLR7 in complex with IMDQ and GGUCCC,N/A
8FZA_0,UGGGUUCCCUCACCCCAAUCAUAAAAAGG,2023-08-30,Class I type III preQ1 riboswitch from E. coli,N/A
8FRU_0,CGCGGCCCGAGGCGGCGGGGGCGACGGGCGGAACUUAAGCAUAUCAGUACGCCCCGGAGGAGAAACCAACCGGGAUUCCCCGUAGCGGCGAGCGACGCGGGAGGAGCCCGCCCCGAAGGCGCGCUGUGGGGCGCACCGCCGCGAGGGGGCCCGAGGGCCCCGCCCGAGAGGGUGCAAGCCCCGUACGGCGGGCGGCGAGUAGCGCUGCUUGAGCGUGCAGCGCGAAGGGAGGCGCGGCCCUUCCAAGGCUAAAUACGCCCCGGGACCGAUAGCGGACCAAGUAGCGCGAGCGAACGGUGAAAAGGACGCCCUGCGGCCGCUCAAAAGACCUGAACCCGGCCGGCCGCCGGCCCGCCGGCCCCGUCUCGAAACACGGACCGAGGAGCCACGCGCCGCGGCGAGCCCGAGGGAGCCCCCGCGGCGGAGCGAGCGCGAGACGCCCCGGGCCCGCCAUGCCCCUGCGGGCGUGCGCGGGCCGAGCCGCGGCGCGUGGGCCCGAAAGGCGGUGAUCUAUGCCCGGCGAGGGCGAGGCCGGGCGAAAGCCUGGUGGAGGCCCGCCGCGGUGCUGACGCGCAGAUCGCUCGUCGGAGCCGGGCAUGGGGGCGAAAGACUCAUCGAACCGCCUGGUAGCUGGUUGCCUCCGAAAUGUCUCCCAGGACAGCCGCCGCCCCGCAGUUGCGGCCCGUAGAGCGCUGGCCGGCGGGAGCGGGGCCUCGCCCGCCCCCCAAACUCCGAAGGGCCGCGCCGCCCCGCCGCUGGCCUGGGCGGGGCGGGCGAAUGCGGGCGGCGCGUGGGCCCCUCCUGGUAAGCAGGACGGGCGAGGCGGGACGAUCCGGACGCCGGGCCAGGGUGCGCCGCCGGGGCCCGCGGAACGGCGUCGGCCGGUCCCGACAGCAGCCGAAUCGGCCGGCCCGGAAAAUGGAGCGCGCCGGAGCCCCGGACCCGCGCCCGGCCGCCGCGCGCGGCGGGUAGGAGGCCGCAGAGGCCCCGGGGGCGAAGGCGGCGCGCAGGCCCCGCCGGACCGGCCUCUGGUGCAGAUCUCGGCAGCAGUAGCCGCUACUCCGCGCCCCGGAGGACUGAGGGGGAGACGGGUUCCGCGGCGCCUGCAUCUGGCCGCGGGUGACUCGGGCCUAAGCGGCGGGUGAAGACCGGGAAGGGGCGUGCCCGCCCGUCGAACGGGGAGCCGGCGGAGACUCCGGCAGGCGCGGCCCCCGCGGAGACGCCCGCCCCCCGGCGACGCGCACGGGGACCGCGGCGGGCGGCGCCCCGGCCCGCGAACGCCCCGCAGCCCCCGGACGCCUUGCGCGGAGAGGGGGGCCCGGGGGCGGACCCCGCGCGUCCCCGGCCGCCCCUGAAAAGCCGGGGGGCGCCGGCCGCGCGCCGUACCGACCGCAGCAGGACUCCGGGGUCAGCAGCCUCUAGCGCGGGAGCGAACGCGGCUCAGGGAAGUCGGCAAGCCGGCUCCGUAACCUCGGGAAAAGGAGUGGCUCUGACGGCCGGGUCAGAACUGGAACGGACGCGGGGAUCCCGACUGUUUACUAGAAACACAGCGUCGCGAGGGCCGCACCCGGCGCUGGCGCGACGUGAUUUCUGCCCAGUGCCACGACCGUCACCGUGAAGCGAUCCGCCGAAGCCCUGGUAAACGGCGGGAGUAACUAUGACUCUCUUAAGGUAGCCAAAUGCCUCGUCGGGCAAUUUCCGACGUGCAUGAAUGGACCAACGAGGAUCCCACUGUCCCGAGCCGCGCCUCCGCGAGCCUCCAGCCUCGGGAACGGGCGAGGGCCGGCCAGCGGGGCAAGAAGACCCUUUUGAGCUUGACUCCAGCCCGGGCCUGUGGGGCGGGGGCCGCCGCCGCCCCGCUCACCCGGUCGCGCGGGGACCCGCCCGGGCGGGGAGUUCGGCUGGGGCGGCGCGCCUGCUACACCGGACCGCAGGCGUCCCACGGCGGGCUCAGCGAGGACGGAGACCUCCCGCGGAGCAGAAGGGCACAAGCCCGCCCGACCCGCGCCCCCCGUGCCGGCGCGGGCCGCGAAAGCGGGGCCUACCGAUCCUUCGCCGCCCCGGCCGCGGGCGCGGAGGUGGCAGAAAAGUUACCACAGGGAUAACUGGCUUGUGGCCGCCGAGCGCCCGCAGCGACGCGGCUUUUUGAUCCUUCGAUGUCGGCUCUUCCUACCGUCCGCGCGCACCGGCGCGGAAGCGUCGGAUUGUUCACCCGUUCAAGGGAUCGUGAGCUGGGUUUAGACCGUCGUGAGACAGGUUAGUUUUACCCUACUGGCCCCGGGGCCAGAGCACGGCGGGCCAGUACGAGAGGAACGCCCGCCGCGGGCCGCCAGCCCCGCGGUUGCCCGGCCGGGCAGCGCCGCGCCGCCGCGCCCGGGGGCCCUGCGCUGACCGCCUCUAAGCGCGCACCCCGCCUCGCGCCCCGCCCGGCCGCGCGCCCCAGCCCCGUGCCCCGUCGCCGAGCGGCCCCCGCCCGGGGAGACCACCCGGCGCGGCGCUCCUGUACGGCGCAGAGCCCUGCGAUCGCCUGAGGGACGCGCCUGCAGAGCGC,2024-01-31,60S subunit of the Giardia lamblia 80S ribosome,N/A
6LSH_0,AGGUCUCUCU,2020-04-29,Crystal structure of the enterovirus 71 polymerase elongation complex (C2S6M form),N/A
6LSH_1,AGAGAGACC,2020-04-29,Crystal structure of the enterovirus 71 polymerase elongation complex (C2S6M form),N/A
4YCO_0,GCGCGGAUAGCUCAGUCGGUAGAGCAGGGGAUUGAAAAUCCCCGUGUCCUUGGUUCGAUUCCGAGUCCGCGCAC,2015-04-22,E. coli dihydrouridine synthase C (DusC) in complex with tRNAPhe,N/A
6BSG_0,GAGGCCACAAUAACUAGUGGCAUA,2018-01-03,Structure of HIV-1 RT complexed with RNA/DNA hybrid in an RNA hydrolysis-off mode,N/A
8R6C_0,GCCGAAGUGGCGAAAGGGACGCAGUUGAUUCAAAUCAACCGUUGCCGGUUCGAGUCCGGCCUUCGGCACCA,2024-07-24,70S Escherichia coli ribosome with Paenilamicin B2 bound with A- and P-site tRNA.,N/A
7JYY_0,AUU,2020-09-16,Crystal Structure of SARS-CoV-2 Nsp16/10 Heterodimer in Complex with (m7GpppA)pUpUpApApA (Cap-0) and S-Adenosylmethionine (SAM).,N/A
4TUW_0,GGCCAAAGGCCCUUUUCAGGGCCACCCC,2014-07-23,"drosophila stem-loop binding protein complexed with histone mRNA stem-loop, phospho mimic of TPNK and C-terminal region",N/A
28SR_0,GGCGUCAGGUCCGGAAGGAAGCAGCGCC,1999-04-20,NMR STRUCTURE OF THE MOST CONSERVED RNA MOTIF IN SRP RNA,N/A
7KQM_0,UCCAGGUGCACDADADADGDADA,2022-03-23,Binary complex of TERT (telomerase reverse transcriptase) with RNA/telomeric DNA hybrid,N/A
2N7C_0,ACAUCA,2016-10-12,Solution structure of Plasmodium falciparum SR1-RRM1 in complex with ACAUCA RNA,N/A
6G2K_0,UUUUUU,2018-10-31,Structure of HuR RRM3 in complex with RNA (UUUUUU),N/A
5XUZ_0,AAUUUCUACUAAGUGUAGAUGGAAAUUAGGUGCGCUUGGC,2017-08-09,Crystal structure of Lachnospiraceae bacterium ND2006 Cpf1 in complex with crRNA and target DNA (CCCA PAM),N/A
4LFB_0,UGGAGAGUUUGAUCCUGGCUCAGGGUGAACGCUGGCGGCGUGCCUAAGACAUGCAAGUCGUGCGGGCCGCGGGGUUUUACUCCGUGGUCAGCGGCGGACGGGUGAGUAACGCGUGGGUGACCUACCCGGAAGAGGGGGACAACCCGGGGAAACUCGGGCUAAUCCCCCAUGUGGACCCGCCCCUUGGGGUGUGUCCAAAGGGCUUUGCCCGCUUCCGGAUGGGCCCGCGUCCCAUCAGCUAGUUGGUGGGGUAAUGGCCCACCAAGGCGACGACGGGUAGCCGGUCUGAGAGGAUGGCCGGCCACAGGGGCACUGAGACACGGGCCCCACUCCUACGGGAGGCAGCAGUUAGGAAUCUUCCGCAAUGGGCGCAAGCCUGACGGAGCGACGCCGCUUGGAGGAAGAAGCCCUUCGGGGUGUAAACUCCUGAACCCGGGACGAAACCCCCGACGAGGGGACUGACGGUACCGGGGUAAUAGCGCCGGCCAACUCCGGCCAGCAGCCCGGUAAUACGGAGGGCGCGAGCGUUACCCGGAUUCACUGGGCGUAAAGGGCGUGUAGGCGGCCUGGGGCGUCCCAUGUGAAAGACCACGGCUCAACCGUGGGGGAGCGUGGGAUACGCUCAGGCUAGACGGUGGGAGAGGGUGGUGGAAUUCCCGGAGUAGCGGUGAAAUGCGCAGAUACCGGGAGGAACGCCGAUGGCGAAGGCAGCCACCUGGUCCACCCGUGACGCUGAGGCGCGAAAGCGUGGGGAGCAAACCGGAUUAGAUACCCGGGUAGUCCACGCCCUAAACGAUGCGCGCUAGGUCUCUGGGUCUCCUGGGGGCCGAAGCUAACGCGUUAAGCGCGCCGCCUGGGGAGUACGGCCGCAAGGCUGAAACUCAAAGGAAUUGACGGGGGCCCGCACAAGCGGUGGAGCAUGUGGUUUAAUUCGAAAACGCGAAGAACCUUACCAGGCCUUGACAUGCUAGGGAACCCGGGUGAAAGCCUGGGGUGCCCCGCGAGGGGAGCCCUAGCACAGGUGCUGCAUGGCCGUCGUCAGCUCGUGCCGUGAGGUGUUGGGUUAAGUCCCGCAACGAGCGCAACCCCCGCCGUUAGUUGCCAGCGGUUCGGCCGGGCACUCUAACGGGACUGCCCGCGAAAGCGGGAGGAAGGAGGGGACGACGUCUGGUCAGCAUGCCCUUACGGCCUGGGCGACACACGUGCUACAAUGCCCACUACAAAGCGAUGCCACCCGGCAACGGGGAGCUAAUCGCAAAAAGGUGGGCCCAGUUCGGAUUGGGGUCUGCAACCCGACCCCAUGAAGCCGGAAUCGCUAGUAAUCGCGGAUCAGCCAUGCCGCGGUGAAUACGUUCCCGGGCCUUGUACACACGCGUACGCCAUGGGAGCGGGCUCUACCCGAAGUCGCCGGGAGCCUACGGGCAGGCGCCGAGGGUAGGGCCCGUGACUGGGGCGAAGUCGAACAAGGUAGCUGUACCGGGGUGCGGCUGGAUCCUCU,2014-07-02,Crystal Structure of 30S ribosomal subunit from Thermus thermophilus,N/A
7R81_0,ACAUACGACCAUACCCACUGGAAAACUCGGGAUCCCGUCCGCUCUCCCAUAGAUAAGCCAGUGAGGGCCAGACUAGUAGUUGGGUCGGUGACGACCAGCGAAUCCCUGGUGUUGUAUGUU,2021-12-01,Structure of the translating Neurospora crassa ribosome arrested by cycloheximide,N/A
5E81_0,CGCGGGGGGAGCAGCCCGGUAGCUCGUCGGGUCAUAACCCGAAGUCGUCGGCAAAUCCGGCCCCCGCAACCA,2016-01-27,Structure of T. thermophilus 70S ribosome complex with mRNA and tRNALys in the A-site with wobble pair,N/A
8HMY_0,GGGCUCUGUGGCGCAAUGGAUAGCGCAUUGGACUUCUAGUGACGAAUAGAGCAAUUCAAAGGUUGUGGGUUCGAAUCCCACCAGAGUCGG,2023-04-19,Cryo-EM structure of the human pre-catalytic TSEN/pre-tRNA complex,N/A
8EWG_0,GGGUCACAACUCCCAUGUAGGCGGAGACUGCAACCCGAAGGUGUGACUUCAUGCCA,2023-08-30,Cryo-EM structure of a riboendonclease,N/A
8C5S_0,GUAAAU,2023-08-30,"Cryo-EM structure of yeast mitochondrial RNA polymerase transcription initiation complex with 7-mer RNA, pppGpGpUpApApApU (IC7)",N/A
8A3Y_0,UAACCGGAGAGGGAACCCACUCAAAAAA,2024-07-31,Structure of mammalian Pol II-DSIF-SPT6-PAF1-TFIIS-hexasome elongation complex,N/A
8C5U_0,GUAAAUG,2023-08-30,"Cryo-EM structure of yeast mitochondrial RNA polymerase transcription initiation complex with 8-mer RNA, pppGpGpUpApApApUpG (IC8)",N/A
9C7A_0,UUDUUUCC,2024-10-02,Crystal structure of R149W neurodevelopmental disease-associated U2AF2 variant,N/A
7QIY_0,UUGACGGAAGGGCACCACCAGGAGUGGAGCCGCGGCUAAUUGACCAACACGGGGAAACUACCAGGCAGACAUAGUAGACUGAGAGCUCUUUCAGGGUGGGUGCAUGGCGUUCUUAGUGGUAUUGCUGGUAAUUCCGUUAACGACGAGACCUCAGCCUGCUAACUAGCUAUGCGGAGGUUCCCUUCGCGGCCAGCUCUUAGAGGGACUACGGCCUUUUAGGCCGCGGAAGUUUGAGGCAAUAACAGUCUGUGAUGCCCUAGAUGUUCUGGGCCGCACGCGCGCUACACUGAUGUAUCAACGAGCUUAUAGCCUUGGCCGACAGGCCCGGGUAAUCUUUGAAAUUCACGUGAUGGGGAUAGAUCAUUGCAAUUGUGGUCUUCAACGGAAUUCCUAGUAAGCGCGAGUCAUCAGCUCGCGUUGACUACGUCCCUGCCCUUGUACACACCG,2022-06-15,Specific features and methylation sites of a plant ribosome. 40S head ribosomal subunit.,N/A
8CD1_0,GCCCGGAUAGCUCAGUCGGUAGAGCAGGGGAUUGAAAAUCCCCGUGUCCUUGGUUCGAUUCCGAGUCCGGGCACCA,2024-01-24,70S-PHIKZ014,N/A
7P7Q_0,GAGAGUUUGAUCCUGGCUCAGGACGAACGCUGGCGGCGUGCCUAAUACAUGCAAGUCGAACGCUUCUUAAGAGGAGUGGCGGACGGGUGAGUAACACGUGGGUAACCUACCCAUCAGAGGGGGAUAACACUUGGAAACAGGUGCUAAUACCGCAUAACAGUUUAUGCCGCAUGGCAUAAGAGUGAAAGGCGCUGGUGUCGCUGAUGGAUGGACCCGCGGUGCAUUAGCUAGUUGGUGAGGUAACGGCUCACCAAGGCCACGAUGCAUAGCCGACCUGAGAGGGUGAUCGGCCACACUGGGACUGAGACACGGCCCAGACUCCUACGGGAGGCAGCAGUAGGGAAUCUUCGGCAAUGGACGAAAGUCUGACCGAGCAACGCCGCGUGAGUGAAGAAGGUUUUCGGAUCGUAAAACUCUGUUGUUAGAGAAGAACAAGGACGUUAGUAACUGAACGUCCCCUGACGGUAUCUAACCAGAAAGCCACGGCUAACUACGUGCCAGCAGCCGCGGUAAUACGUAGGUGGCAAGCGUUGUCCGGAUUUAUUGGGCGUAAAGCGAGCGCAGGCGGUUUCUUAAGUCUGAUGUGAAAGCCCCCGGCUCAACCGGGGAGGGUCAUUGGAAACUGGGAGACUUGAGUGCAGAAGAGGAGAGUGGAAUUCCAUGUGUAGCGGUGAAAUGCGUAGAUAUAUGGAGGAACACCAGUGGCGAAGGCGGCUCUCUGGUCUGUAACUGACGCUGAGGCUCGAAAGCGUGGGGAGCAAACAGGAUUAGAUACCCUGGUAGUCCACGCCGUAAACGAUGAGUGCUAAGUGUUGGAGGGUUUCCGCCCUUCAGUGCUGCAGCAAACGCAUUAAGCACUCCGCCUGGGGAGUACGACCGCAAGGUUGAAACUCAAAGGAAUUGACGGGGGCCCGCACAAGCGGUGGAGCAUGUGGUUUAAUUCGAAGCAACGCGAAGAACCUUACCAGGUCUUGACAUCCUUUGACCACUCUAGAGAUAGAGCUUUCCCUUCGGGGACAAAGUGACAGGUGGUGCAUGGUUGUCGUCAGCUCGUGUCGUGAGAUGUUGGGUUAAGUCCCGCAACGAGCGCAACCCUUAUUGUUAGUUGCCAUCAUUUAGUUGGGCACUCUAGCGAGACUGCCGGUGACAAACCGGAGGAAGGUGGGGAUGACGUCAAAUCAUCAUGCCCCUUAUGACCUGGGCUACACACGUGCUACAAUGGGAAGUACAACGAGUCGCUAGACCGCGAGGUCAUGCAAAUCUCUUAAAGCUUCUCUCAGUUCGGAUUGCAGGCUGCAACUCGCCUGCAUGAAGCCGGAAUCGCUAGUAAUCGCGGAUCAGCACGCCGCGGUGAAUACGUUCCCGGGCCUUGUACACACCGCCCGUCACACCACGAGAGUUUGUAACACCCGAAGUCGGUGAGGUAACCUUUUUGGAGCCAGCCGCCUAAGGUGGGAUAGAUGAUUGGGGUGAAGUCGUAACAAGGUAGCCGUAUCGGGGUGCGGCUGGAUCACCUCCU,2022-02-23,"E. faecalis 70S ribosome bound by PoxtA-EQ2, high-resolution combined volume",N/A
8RC2_0,UUAUCGGCGAGACCGGGAUGCACCUCCCGAAGGGUCU,2024-11-06,DNA bound type IV-A3 CRISPR effector complex from K. pneumoniae,N/A
8RC2_1,DGDADCDCDCDTDTDCDGDGDGDADGDGDTDGDCDADTDCDCDCDGDGDTDCDTDCDGDCDTDTDGDGDCDCDTDCDC,2024-11-06,DNA bound type IV-A3 CRISPR effector complex from K. pneumoniae,N/A
8RC2_2,DGDGDADGDGDCDCDADADGDADTDCDTDCDADADT,2024-11-06,DNA bound type IV-A3 CRISPR effector complex from K. pneumoniae,N/A
6IFL_0,ACGGAAACGCUUUCUAGCUCGCUAUAAUUACCCAU,2018-12-12,Cryo-EM structure of type III-A Csm-NTR complex,N/A
6IFL_1,AAUGGGUAAUUAUAGCGAGCUAGAAAGCGUUUCCG,2018-12-12,Cryo-EM structure of type III-A Csm-NTR complex,N/A
8IBZ_0,UGUACACGUGGUAAACACGUGACAGCAGCCCCGAUGGACGGACCGCGAGGACCGUCAAGCCUAGCAGGUACCUUCGGGUGGGGCCUUGCGAUACCUGCGGGCGAACCCUGUGGUCGGGUUUGCAGCCCGGCCACAGCCUGUUGCAAAAAAGUCAAAUAAAGGUAGAUCAGCUGAUCCAAU,2023-09-20,Structure of R2 with 5'ORF and 3'UTR,N/A
9C7B_0,UUDUUUCC,2024-10-02,Crystal structure of R150H neurodevelopmental disease-associated U2AF2 variant,N/A
8SQJ_0,AGCAUGCUACGUCAUUCUCCACGCGAAGCAUG,2023-11-22,"SARS-CoV-2 replication-transcription complex bound to RNA-nsp9, as a noncatalytic RNA-nsp9 binding mode",N/A
8SQJ_1,UGUCAUGCUUCGCGUGGAGAAUGACGUAGCAUGCU,2023-11-22,"SARS-CoV-2 replication-transcription complex bound to RNA-nsp9, as a noncatalytic RNA-nsp9 binding mode",N/A
7O5B_0,GCCGUGCUAAGCGGGGAGGUAGCGGUGCCCUGUACCUGCAAUCCGCUCUAGCAGGGCCGAAUCCCUUCUCGAGGUUCGUUUACUUUAAGGCCUGCCUUAAGUAAGUGGUGUUGACGUUUGGGUCCUGCGCAAUGGGAAUUCAUGAACCAUGUCAGGUCCGGAAGGAAGCAGCAUUAAGUGAAACCUCUCAUGUGCCGCAGGGUUGCCUGGGCCGAGCUAACUGCUUAAGUAACGCUAGGGUAGCGAAUCGACAGAAGGUGCACGGU,2022-02-02,Cryo-EM structure of a Bacillus subtilis MifM-stalled ribosome-nascent chain complex with (p)ppGpp-SRP bound,N/A
8W1P_0,UUUAGAAGGAGAAGUCAUUUAAUAAGGCCACUGUUAAAAAGUGUACCGCCGGAUAGGCGG,2024-08-07,Structure of Selenomonas sp. Cascade (SsCascade),N/A
8R3K_0,AGUAGAAACAAGGGUGUAUUUUCCCCUCUUU,2024-02-21,"Influenza A/H7N9 polymerase in self-stalled pre-termination state, with Pol II pS5 CTD peptide mimic bound in site 1A/2A.",N/A
8R3K_1,GGGGAAAAUA,2024-02-21,"Influenza A/H7N9 polymerase in self-stalled pre-termination state, with Pol II pS5 CTD peptide mimic bound in site 1A/2A.",N/A
8B3D_0,AUCGAGAGGA,2023-09-27,Structure of the Pol II-TCR-ELOF1 complex.,N/A
8K88_0,AUAAUGGUUUCUUAGACGUCDG,2024-07-03,Structure of procaryotic Ago,N/A
7ZLQ_0,CGAAGCCUUCGCG,2023-10-25,Crystal structure of ADAR1-dsRBD3 dimer in complex with dsRNA,N/A
8C6J_0,AUCGCUUCUCGGCCUUUUGGCUAAGAUCAAGUGUAGUAUCUGUUCUUAUCAGUUUAAUAUAUAUUAAAUGGAUUUUUGGAGCAGGGAGAUGGAGUCCACUCCACGCAUCGACCUGGUAUUGCAGUACCUCCAGGAACGGUGC,2023-07-12,Human spliceosomal PM5 C* complex,N/A
8C6J_1,GUGCUCGCUUCGGCAGCACAUAUACUAAAAUUGGAACGAUACAGAGAAGAUUAGCAUGGCCCCUGCGCAAGGAUGACACGCAAAUUCGUGAAGCGUU,2023-07-12,Human spliceosomal PM5 C* complex,N/A
8BF8_0,GUUGGUGGCUGCGGGAAUCUCAGACACCUUAAACGCUCAUGGAGGCUAUGUCAGACCUGGGCAAUGGUCUGCGAAGUGAGAAUCACGCGACGUCGUGUGAGGUUCAAGAGU,2023-04-12,ISDra2 TnpB in complex with reRNA,N/A
6JDV_0,GGUCACUCUGCUAUUUAACUUUACGUUGUAGCUCCCUUUCUCAUUUCGGAAACGAAAUGAGAACCGUUGCUACAAUAAGGCCGUCUGAAAAGAUGUGCCGCAACGCUCUGCCCCUUAAAGCUGCUUUAAGGGGCAUCGUUUAU,2019-11-06,Crystal structure of Nme1Cas9 in complex with sgRNA and target DNA (ATATGATT PAM) in catalytic state,N/A
8BF9_0,AGCAUAUUAGUCAGCGGAGGAGAAGUGAACAGGGAAGAGCCCAGCGCCAAUCCCGCCCCGGCGGGGCGGGGACAUGUGGCGUACGGAAGGGGCCCAAGUCCUUCUGACGAGGCGCCCGUGGCGGUGGAGGCGGUAGGGCCCCGGAGUCGGGUUGCUUGGGAAUGCAGCCCAAAGCGGGUGGUAAACUCCAUCUAAGGCUAAUACCGGCACGAGACCGAUAGUCAACAAGUACCGUAAGGGAAAGUUGAAACUUUGAAGAGAGAGUUCAAGAGGCGUGAAACCGUUCGACCCGUCUUGAAACACGGACCAAGGAGUCUAACACGUGCGCGAGUCGGGGCUCGCACGAAAGCCCGUGGCGCAAUGAGCGCACGUGUUAGGACCCGAAAGAUGGUGAACUAUGCCUGGGCAGGGCGAAGCCAGAGGAAACUCUGGUGGAGGUCCGUAGCGGUCCUGACGUGCAAAUCGGUCGUCCUGGGUAUAGGGGCGAAAGACUAACGAACCAUCUAGUAGCUGGUUCCCUCCGGGGCCGCUGCGGUGAGCCUUGAAGCCUAGGGCGCGGGCCCGGGUGGAGCCGCCGCAGGUGCAGAUCUUGGUGGUAGUAGCAAAUAUUCAAACGAGCUUUGAAGGCCGAGUGGAGAAGGGUUCCAUGUAACAGCAGUUGAACAUGGGUCAGUCGGUCCUGAGAGAUGGGCGAGCGCCGUUCGAAGGGACGGGCGAUGGCCUCCGUUGCCCUCGGCCGAUCGAAAGGGAGUCGGGUUCAGAUCCCCGAAUCCGGGGCGGAGAUGGCGCCGCGAGGCGUCCAGUGCGGUAACGCGACCGAUCCCGGAGAAGCCGGCGGGAGCCCCGGGGAGAGUUUCUUUUCUUUUGAAGGGCAGGGCGCCCUGGAAUGGGUUCGCCCCGAGAGAGGGGCCCGUGCCUUGGAAAGCGUCGCGGUCCGGCGGCGUCCGGUGAGCUCUCGCUGGCCCUUGAAAAUCCGGGGGAGAGGGUGUAAAUCUCGCGCCGGGCCGUACCCAUAUCCGCAGCAGGUCUCCAAGGUGAACAGCCUCUGGCAUGUUGGAACAAUGUAGGUAAGGGAAGUCGGCAAGCCGGAUCCGUAACUUCGGGAUAAGGAUUGGCUCUAAGGGCUGAGCAGCCGACUUAGAACUGGUGCGGACCAGGGGAAUCCGACUGUUUAAUUAAAACAAAGCAUCGCGAAGGCCCGCGGCGGGUGUUGACGCGAUGUGAUUUCUGCCCAGUGCUCUGAAUGUCAAAGUGAAGAAAUUCAAUGAAGCGCGGGUAAACGGCUAAGGUAGCCAAAUGCCUCGUCAUCUAAUUAGUGACGCGCAUGAAUGGAUGAACGAGAUUCCCACUGUCCCUACCUACUAUCCAGCGAAACCACAGCCAAGGGAACGGGCUUGGCGGAAUCAGCGGGGAAAGAAGACCCUGUUGAGCUUGACUCUAGUCUGGCACGGUGAAGAGGUUUUUUCACUGACCCGGUGAGGCGGGGGCGCUUCUGGCGCCAAGCGCCCGGCCGCCCGGCCGGCGCGACCCGCUCCGGGGACAGUGCCAGGUGGGGAGUUUGACUGGGGCGGUACUUGGGUUUUAAGCAGGAGGUGUCAGAAAAGUUACCACAGGGAUAACUGGCUUGUGAUCCUUCGAUGUCGGCUCUUCACCCACUAAUAGGGAACGUGAGCUGGGUUUAGACCGUCGUGAGACAGGUUAGUUUUACCCUACUGAUGAUGUAUGUGCUUGGCUGAGGAGCCAAUGGGGCGAAGCUACCAUCUGUG,2023-11-01,Molecular view of ER membrane remodeling by the Sec61/TRAP translocon.,N/A
5J0M_0,GGCAGAUCUGAGCCUGGGAGCUCUCUGCC,2016-06-08,Ground state sampled during RDC restrained Replica-averaged Metadynamics (RAM) simulations of the HIV-1 TAR complexed with cyclic peptide mimetic of Tat,N/A
8QRN_0,AGUAAGGUCAGCUAAAUAAGCUAUCGGGCCAUACCCCGAAAAUGUUGGUUAUACCCUUCCCGUACUACCA,2024-06-26,"mt-SSU in GTPBP8 knock-out cells, state 4",N/A
7EFG_0,GGCGAAGAACCGGGGAGCC,2022-04-13,RNA kink-turn motif,N/A
6C63_0,GCGUACGAAGGAGAGGAGAGGAAGAGGAGAGUACGC,2018-08-08,Crystal Structure of the Mango-II Fluorescent Aptamer Bound to TO1-Biotin,N/A
6PMO_0,AAGUGGGUGCGCGUUGGCGCAUCACUCGGGUGGAACCGCGGGAGCUGCUCUCGUCCCGAG,2019-11-20,Co-crystal structure of the Geobacillus kaustophilus glyQ T-box riboswitch discriminator domain in complex with tRNA-Gly,N/A
6SKG_0,GGUACGGCGGCCAUAGCGGCGGGGCCACACCCGGUCUCGUUUCGACCCCGGAAGUUAAGCCCGCCAGCGUUCCCGGGUGUACUGCCCUCCGAGAGGGGGCGGGAAACCGGGAACGCCGCCGGCCA,2020-07-29,Cryo-EM Structure of T. kodakarensis 70S ribosome in TkNat10 deleted strain,N/A
3IVN_0,GGCCAGUAUAACCUCAAUGAUAUGGUUUGAGGGUGUCUACCAGGAACCGUAAAAUCCUGACUACUGGUC,2010-01-19,Structure of the U65C mutant A-riboswitch aptamer from the Bacillus subtilis pbuE operon,N/A
7CPU_0,AGCAGAGUGGCGCAGCGGAAGCGUGCUGGGCCCAUAACCCAGAGGUCGAUGGAUCGAAACCAUCCUCUGCUACCA,2022-02-02,Cryo-EM structure of 80S ribosome from mouse kidney,N/A
7EAG_0,GUCUAUGAAGGCUGGAGAC,2021-06-02,Crystal structure of the RAGATH-18 k-turn,N/A
7EAG_1,GUCUAUGAAGGCUGGAGAC,2021-06-02,Crystal structure of the RAGATH-18 k-turn,N/A
7EAG_2,GUCUAUGAAGG,2021-06-02,Crystal structure of the RAGATH-18 k-turn,N/A
7EAG_3,CUGGAGAC,2021-06-02,Crystal structure of the RAGATH-18 k-turn,N/A
7EAG_4,GUCUAUGAAGGCUGGAGAC,2021-06-02,Crystal structure of the RAGATH-18 k-turn,N/A
7EAG_5,GUCUAUGAAGGCUGGAGAC,2021-06-02,Crystal structure of the RAGATH-18 k-turn,N/A
1H38_0,GCGGCGAU,2002-11-20,Structure of a T7 RNA polymerase elongation complex at 2.9A resolution,N/A
8J7S_0,UGACGGCUCUAAUCUAUUA,2024-03-06,Structure of the SPARTA complex,N/A
