target_id,sequence,temporal_cutoff,description,all_sequences
7KUC_0,GGAGGAAGGAGCCUCC,2022-06-01,Ax1 Domain of VEGF Readthrough Element,N/A
7ZEX_0,UAAUGUCG,2022-05-04,Complex Cyp33-RRMdelta alpha : UAAUGUCG RNA,N/A
7KUB_0,CUGCUCUACCUUCACCAUGCCAAGUGGUCCCAGGCUGCACCCAUGGCAGAAGGAGGGCAG,2022-06-01,Au1 Domain of VEGF Readthrough Element,N/A
7KUD_0,GGUUUCGGGAACC,2022-06-01,Ax2 Domain of VEGF Readthrough Element,N/A
9CDB_0,AAA,2024-10-30,"CryoEM structure of CRISPR associated effector, CARF-Adenosine deaminase 1, Cad1, in cA6 (partial density) bound form with ATP (partial density).",N/A
7ZEW_0,AAUAAA,2022-04-13,Complex Cyp33-RRM : AAUAAA RNA,N/A
7SHX_0,GGACCCAUAACCCACCUAGACCCUAGCUUCGGCUAGAGGGUCAACGCGAAAGCGAGGCCGGGUGGGCGGGUACGUCCGCCCUGGGGAGGGGUCC,2022-10-19,"A functional SNP regulates E-cadherin expression by dynamically remodeling the 3D structure of a promoter-associated non-coding RNA transcript, NMR, minimized average structure",N/A
7RWR_0,GGAUACACAAGAGUGAUUGAAACUAAGUCUGUGUAUCC,2022-07-20,An RNA aptamer that decreases flavin redox potential,N/A
7Q33_0,AGCUUUG,2023-02-08,Solution structure of RBM39 RRM2 bound to 5'-AGCUUUG-3,N/A
4CIO_0,GGUGUGC,2014-09-03,RRM domain from C. elegans SUP-12 bound to GGUGUGC RNA,N/A
7PS8_0,CAGGGAGGUGUGGCCUGGGCGGG,2023-04-05,NMR Structure of the U3 RNA G-quadruplex,N/A
7UMD_0,GGACGUGGACCGACUUCGGUCGGAAGGAAACUUAACGUCC,2022-07-06,DENV1 SLA three-way junction RNA (DenvSLAsh),N/A
8I45_0,GGACGCUUUCGAGCGGUCC,2023-03-29,Interaction between a fluoroquinolone derivative KG022 and RNAs: effect of base pairs 3' adjacent to the bulge out residues,N/A
7VRL_0,UGCAUAU,2022-10-26,Solution structure of Rbfox RRM bound to a non-cognate RNA,N/A
9CPG_0,GACAGCUGCUGUC,2024-08-07,Structures of small molecules bound to RNA repeat expansions that cause Huntington's disease-like 2 and myotonic dystrophy type 1,N/A
9CPG_1,GACAGCUGCUGUC,2024-08-07,Structures of small molecules bound to RNA repeat expansions that cause Huntington's disease-like 2 and myotonic dystrophy type 1,N/A
7QDE_0,AUCCAGUGGAA,2022-12-21,NMR structure of Npl3 RRM12 bound to the AUCCAGUGGAA RNA,N/A
7UMC_0,GGAGUGGUUAGUCUACGUGGACCGACAAGACUUCGGUCGAAUCGGAAGGAAACUUAACGUAGUUCUAACC,2022-07-06,DENV1 SLA RNA (DenvSLATL),N/A
9CPI_0,GACAGCUGCUGUC,2024-08-07,Structures of small molecules bound to RNA repeat expansions that cause Huntington's disease-like 2 and myotonic dystrophy type 1,N/A
9CPI_1,GACAGCUGCUGUC,2024-08-07,Structures of small molecules bound to RNA repeat expansions that cause Huntington's disease-like 2 and myotonic dystrophy type 1,N/A
8K15_0,GUACGACGGGCAUGUCGUACAUCUGAGGUGCAAGUCCUCUGUGGACACCUGCUACCGGUGAACCCAAUAGCGACUCCCAAGCCUGACUAUCGCGAGGUAACGGGGAGAGGAAGGGAUAGCGAAAUCGUGGCUCUACGAACAGAAACGUGAUAUUAAGGCGUAUAUAGUGGAUGAGGGGGCUAGGCACUCUAAAGUCCAAAAAGGUAGUCGUAAUCUAUGUGCGUAAAUCACGAGAGUAAACGAGGAAAGAUGUACGACUUAUCCCGUGAGGUCUCAUGAGCGUCAGUAGACGUAGUAAUAACGAAUCAUGAGAAGUCAGCCGAGGUCAUAGUAGUGAUGAAGUUUCUGUAAUGGAAACGGAGCGAAGGACCGAACGAUUAAACAGAACGUAUGCUGUUUAGUUGAACCGCCGUGUGCCGAACGGCACGCACGGUGGUGUGAGAGGGACUAUCAAUUAGUCCCUACUCGAU,2024-05-15,The Streptococcus azizii ORF-less Group IIC intron HYER2 at apo state,N/A
8I43_0,GGACGCUUUCGAGCCGUCC,2023-03-29,Interaction between a fluoroquinolone derivative KG022 and RNAs: effect of base pairs 3' adjacent to the bulge out residues,N/A
8BWT_0,GGCGUUUUCGCUUCGGCGUUUACGCC,2023-08-30,Structure of a symmetrical internal loop motif with three consecutive U:U mismatches from stem-loop 1 in the 3'-UTR of the SARS-CoV2 genomic RNA,N/A
1HG9_0,GCAUAUCAG,2002-01-02,Solution structure of DNA:RNA hybrid,N/A
9CPJ_0,GACAGCUGCUGUC,2024-08-07,Structures of small molecules bound to RNA repeat expansions that cause Huntington's disease-like 2 and myotonic dystrophy type 1,N/A
9CPJ_1,GACAGCUGCUGUC,2024-08-07,Structures of small molecules bound to RNA repeat expansions that cause Huntington's disease-like 2 and myotonic dystrophy type 1,N/A
8Z97_0,GCCUGUUUUUGCU,2024-05-29,Cryo-EM structure of Thogoto virus polymerase in a transcription elongation conformation,N/A
8Z97_1,GCAAAAACA,2024-05-29,Cryo-EM structure of Thogoto virus polymerase in a transcription elongation conformation,N/A
8JHP_0,ACUCGAAAGAACAUGUUUUCCAAGAGU,2024-05-29,Another hairpin structure found in the RNA element involved in piRNA biogenesis,N/A
7Q48_0,GGGCCAUUGGGUGGGAUCUGGG,2022-11-16,Solution structure of an intramolecular RNA G-quadruplex formed by the 6A8U17U mutant from a 22mer guanine-rich sequence within the 5'UTR of BCL-2 proto onco-gene,N/A
6N6H_0,CU,2019-06-12,Vibrio cholerae Oligoribonuclease bound to pCpU,N/A
7FGI_0,U,2022-07-27,Cryo-EM Structure of Chikungunya Virus Nonstructural Protein 1 with m7Gppp-AU,N/A
9CPD_0,GACAGCUGCUGUC,2024-08-07,Structures of small molecules bound to RNA repeat expansions that cause Huntington's disease-like 2 and myotonic dystrophy type 1,N/A
9CPD_1,GACAGCUGCUGUC,2024-08-07,Structures of small molecules bound to RNA repeat expansions that cause Huntington's disease-like 2 and myotonic dystrophy type 1,N/A
8RDU_0,AGCGCCGCAAUUCAUGCUGCUUGCAGCCUCUGAAUUUUGUUAAAUGAGGGUUAGUUUGACUGUAUAAAUACAGUCUUGCUUUCUGACCCUGGUAGCUGCUCACCCUGAUGCUGCUGUCAAUAGACAGGAUAGGUGCGCUCCCAGCAAUAAGGGCGCGGAUGUACUGCUGUAGUGGCUACUGAAUCACCCCCGAUCAAGGGGGAACCCUCCAAAAGGUGGGUUGAAAGGAGAAGUCAUUUAAUAAGG,2024-06-19,Conformational Landscape of the Type V-K CRISPR-associated TransposonIntegration Assembly CAST V-K composite map,N/A
8JY0_0,GAACCUCCGCCCAUUGCACUCCGGGCGGUGAAGGAGAGGCGCAAGGUUAACCGCCUCAGGUUCC,2024-05-29,Crystal structure of RhoBAST complexed with TMR-DN,N/A
8WUV_0,GGCCGUAGUGCUUGCUCUGAGUUUUAGAGCUAGAAAUAGCAAGUUAAAAUAAGGCUAGUCCGUUAUCAACUUGAAAAAGUGGCACCGAGUCGGUGCAUGCAACCAAACCACAGCGUGCUCAGUCUG,2024-06-05,SpCas9-MMLV RT-pegRNA-target DNA complex (elongation 16-nt),N/A
7NEJ_0,CCGUGUAG,2021-04-07,Solution structure of DNA:RNA hybrid duplex,N/A
4A4T_0,GGACCCGGCUUACGCUGGGUCC,2012-05-30,UNAC Tetraloops: To What Extent Can They Mimic GNRA Tetraloops,N/A
8UO6_0,GCCCGGAUAGCUCAGUCGGUAGAGCAGCGGGCACUAUGGGCGCAGUGUCAAUGGACGCUGACGGUACAGGCCAGACAAUUAUUGUCUGGUAUAGUGCCCGCGGGUCCAGGGUUCAAGUCCCUGUUCGGGCGCCA,2024-06-05,HIV-1 Rev Response Element (RRE) Stem-Loop II (SLII),N/A
2XEB_0,GAUCGUAGCCAAUGAGGUU,2010-05-26,NMR STRUCTURE OF THE PROTEIN-UNBOUND SPLICEOSOMAL U4 SNRNA 5' STEM LOOP,N/A
2XEB_1,GCCGAGGCGCGAUC,2010-05-26,NMR STRUCTURE OF THE PROTEIN-UNBOUND SPLICEOSOMAL U4 SNRNA 5' STEM LOOP,N/A
8KAH_0,GUAGCAAGUUAAAAUAAGGCUAGUCCGUUAUCAACUUGAAAAAGUGGCACCGAGUCGGUGCUU,2024-06-05,Crystal structure of SpyCas9-crRNA-tracrRNA complex bound to 18nt target DNA,N/A
8WUT_0,GGCCGUAGUGCUUGCUCUGAGUUUUAGAGCUAGAAAUAGCAAGUUAAAAUAAGGCUAGUCCGUUAUCAACUUGAAAAAGUGGCACCGAGUCGGUGCGAUCGUGCUCAGUCUG,2024-06-05,SpCas9-MMLV RT-pegRNA-target DNA complex (initiation),N/A
8JTJ_0,GGCGCAUAAAGAUGAGACGCGGUCAUAGUUCCCCUGAGAAAUCAGGGUUACUAUGAUAAGGGCUUUCUGCCUAAGGCAGACUGACCCGCGGCGUUGGGGAUCGCCUG,2024-06-05,Cryo-EM structure of GeoCas9-sgRNA-dsDNA ternary complex,N/A
8UO6_0,GCCCGGAUAGCUCAGUCGGUAGAGCAGCGGGCACUAUGGGCGCAGUGUCAAUGGACGCUGACGGUACAGGCCAGACAAUUAUUGUCUGGUAUAGUGCCCGCGGGUCCAGGGUUCAAGUCCCUGUUCGGGCGCCA,2024-06-05,HIV-1 Rev Response Element (RRE) Stem-Loop II (SLII),N/A
8JTR_0,GGCGCAUAAAGAUGAGACGCGGUCAUAGUUCCCCUGAGAAAUCAGGGUUACUAUGAUAAGGGCUUUCUGCCUAAGGCAGACUGACCCGCGGCGUUGGGGAUCGCC,2024-06-05,Cryo-EM structure of GeoCas9-sgRNA binary complex,N/A
8KAL_0,CGUGUUCUAAUUGAAGGUUUUAGAGCUAGAAAUAGCAAGUUAAAAUAAGGCUAGUCCGUUAUCAACUUGAAAAAGUGGCACCGAGUCGGUGCUC,2024-06-05,Crystal structure of SpyCas9 in complex with sgRNA and 17nt target DNA,N/A
8CLR_0,GGCAGCUUGCUGCC,2023-07-19,Integrated NMR/MD structure determination of a dynamic and thermodynamically stable CUUG RNA tetraloop,N/A
8Z85_0,AGAGAAAUCAAGG,2024-05-29,Cryo-EM structure of Thogoto virus polymerase in transcription pre-initiation conformation 1,N/A
8Z98_0,GCAAAAACA,2024-05-29,Cryo-EM structure of Thogoto virus polymerase in a transcription reception conformation,N/A
3WFS_0,GGCCAGGUAGCUCAGUUGGUAGAGCACUGGACUGAAAAUCCAGGUGUCGGCGGUUCGAUUCCGCCCCUGGCCAC,2014-01-01,tRNA processing enzyme complex 3,N/A
8Z9Q_0,GCAAAAACA,2024-05-29,Cryo-EM structure of Thogoto virus polymerase in a replication reception conformation,N/A
4V3P_0,AAAAAAAAAAAAAAAAAAAAAAAAAAAAAAAAAAAAAAAAAAAAAAAAAAAAAAAAAAAAAAAAAAAAAAAAAAAAAAAAAAAAAAAAAAAAGGGGGGGGGGGGGGGGGGGGGGGAAAAAAAAAAAAAAAAAAAAAAACCCCCCCCCCCCCCCCCCCCCCCUUUUUUUUUUUUUUUUUUUUUUUUUUUUUUUUUUUUUUUUUUUUUUCCCCCCCCCCCCCCCCCCCCCCCAAAAAAAAAAAAAAAAAAAAAAA,2015-04-22,The molecular structure of the left-handed supra-molecular helix of eukaryotic polyribosomes,N/A
8Z85_0,UUGCU,2024-05-29,Cryo-EM structure of Thogoto virus polymerase in transcription pre-initiation conformation 1,N/A
9DLL_0,GACAGCAGCUGUC,2024-09-25,NMR structures of small molecules bound to a model of an RNA CAG repeat expansion.,N/A
9BLM_0,GGCCUGGGAUAGACUAGGAGAUCUUCUGCUCUGCACAACCUUCGGGUGGUGCGAGACACAGGAUACU,2024-11-27,Structure of West Nile Virus 3'- stem-loop_68NTS,N/A
9DLL_0,GACAGCAGCUGUC,2024-09-25,NMR structures of small molecules bound to a model of an RNA CAG repeat expansion.,N/A
8SSW_0,CAAGGUCAUUCGCAAGAGUGGCC,2024-05-22,Crystal structure of DEAD-box RNA helicase DDX3X in complex with ADP at pre-unwound state,N/A
8SSW_1,GUCAUUCGCAAGAGUGGCCUUGC,2024-05-22,Crystal structure of DEAD-box RNA helicase DDX3X in complex with ADP at pre-unwound state,N/A
9BUN_0,GGACUCGGAAACGUGAAGGAGAGGCGCAAGGUUAACCGCCUCAGUCCA,2024-06-05,RhoBAST aptamer RNA in complex with 5(6)-carboxytetramethylrhodamine,N/A
8R08_0,UUUUU,2024-05-22,Cryo-EM structure of the cross-exon pre-B+AMPPNP complex,N/A
8R0A_0,CGCUUCUCGGCAAGUGUAGUAUCUGUUCUUAUCAGUUUAAUAUCUGAUGGAUUUUUGGAGCAUCGACCUGGUAUUGCAGUACCUCCAGGAACGGUGC,2024-05-22,Cryo-EM structure of the cross-exon pre-B+5'ss complex,N/A
8R09_0,CGCUUCUCGGCCAAGUGUAGUAUCUGUUCUUAUCAGUUUAAUAUCUGAUGGAUUUUUGGAGCAUCGACCUGGUAUUGCAGUACCUCCAGGAACGGUGC,2024-05-22,Cryo-EM structure of the cross-exon pre-B+5'ss+ATPgammaS complex,N/A
8QZS_0,CGCUUCUCGGCCAAGUGUAGUAUCUGUUCUUAUCAGUUUAAUAUCUGAUAGAUUUUUGGAGCAUCGACCUGGUAUUGCAGUACCUCCAGGAACGGUGC,2024-05-22,Cryo-EM structure of the cross-exon B-like complex,N/A
9H82_0,AUCUUCUUCGAUUUCUUCCAUC,2024-12-04,Small circular RNA dimer - Class 1,N/A
9H82_1,UGGAAGAAAUCGAAGAAGAUGAAGAACGCGAAGAAC,2024-12-04,Small circular RNA dimer - Class 1,N/A
9H86_0,UGGAAGAAAUCGAAGAAGAUGAAGAACGCGAAGAAC,2024-12-04,Small circular RNA dimer - Class 4,N/A
9H86_1,AUCUUCUUCGAUUUCUUCCAGUUCUUCGCGUUCUUC,2024-12-04,Small circular RNA dimer - Class 4,N/A
9H86_2,AUCUUCUUCGAUUUCUUCCAGUUCUUCGCGUUCUUC,2024-12-04,Small circular RNA dimer - Class 4,N/A
9H86_3,UGGAAGAAAUCGAAGAAGAUGAAGAACGCGAAGAAC,2024-12-04,Small circular RNA dimer - Class 4,N/A
9C3I_0,ACCAGGAUGGCCGAGUGGAAGGCGUUGGACUUAAGAUCCAAUGCGUGGGCGAACCCCACUCCUGGUACCA,2024-12-04,Rebuilt CNOT3/tRNA-LEU structure,N/A
8WCE_0,UGCUUCACGUAGGCCUUGGAGCCGUACAUGGUUGUAACAAGCCUAAGUUUGAAAGGUAAAAACAAC,2024-05-22,Cryo-EM structure of a protein-RNA complex,N/A
4V7E_0,UCCGUGAUAGUUUAAUGGUCAGAAUGGGCGCUUGUCGCGUGCCAGAUCGGGGUUCAAUUCCCCGUCGCGGAGCCA,2014-07-09,Model of the small subunit RNA based on a 5.5 A cryo-EM map of Triticum aestivum translating 80S ribosome,N/A
9H83_0,UGGAAGAAAUCGAAGA,2024-12-04,Small circular RNA dimer - Class 2,N/A
9H83_1,AUCUUCUUCGAUUUCUUCCUC,2024-12-04,Small circular RNA dimer - Class 2,N/A
9H83_2,AUCUUCUUCGAUUUCUUCCAGUUCUUCGCGUUCUUC,2024-12-04,Small circular RNA dimer - Class 2,N/A
9H83_3,UGGAAGAAAUCGAAGAAGAUGAAGAACGCGAAGAAC,2024-12-04,Small circular RNA dimer - Class 2,N/A
9C3H_0,GGCCGCGUCCUAAGAAAGGCCUGAUUCCGAUCAGAAGAUGAGGGCGGUCCCUUCGUGGUCGCCA,2024-12-04,Structure of the CNOT3-bound human 80S ribosome with tRNA-ARG in the P-site.,N/A
8GLP_0,GUCUACGGCCAUACCACCCUGAACGCGCCCGAUCUCGUCUGAUCUCGGAAGCUAAGCAGGGUCGGGCCUGGUUAGUACUUGGAUGGGAGACCGCCUGGGAAUACCGGGUGCUGUAGGCUU,2023-04-19,mRNA decoding in human is kinetically and structurally distinct from bacteria (Consensus LSU focused refined structure),N/A
6N6I_0,GG,2019-06-12,Human REXO2 bound to pGG,N/A
2U2A_0,GGUCAGUGUAACAACUGACC,1998-03-04,"STEM LOOP IIA FROM U2 SNRNA OF SACCHAROMYCES CEREVISIAE, NMR, MINIMIZED AVERAGE STRUCTURE",N/A
3IGI_0,UGUGCCCGGCAUGGGUGCAGUCUAUAGGGUGAGAGUCCCGAACUGUGAAGGCAGAAGUAACAGUUAGCCUAACGCAAGGGUGUCCGUGGCGACAUGGAAUCUGAAGGAAGCGGACGGCAAACCUUCGGUCUGAGGAACACGAACUUCAUAUGAGGCUAGGUAUCAAUGGAUGAGUUUGCAUAACAAAACAAAGUCCUUUCUGCCAAAGUUGGUACAGAGUAAAUGAAGCAGAUUGAUGAAGGGAAAGACUGCAUUCUUACCCGGGGAGGUCUGGAAACAGAAGUCAGCAGAAGUCAUAGUACCCUGUUCGCAGGGGAAGGACGGAACAAGUAUGGCGUUCGCGCCUAAGCUUGAACCGCCGUAUACCGAACGGUACGUACGGUGGUGU,2009-12-22,Tertiary Architecture of the Oceanobacillus Iheyensis Group II Intron,N/A
8P0B_0,UUUGCU,2024-05-22,Thogoto virus polymerase in Mode B conformation and bound to 32-mer loop promoter RNA,N/A
8QBL_0,UGCGCACCCUUAGCGAGAGGCCUCUGGAUGUUGCGGCAUCCUGCAUUGAAUCUGAGUUACU,2024-06-05,"Retron-Eco1 filament with inactive effector (E106A, 2 segments)",N/A
4V49_0,GGUCAAGAUAGUAAGGGUCCACGGUGGAUGCCCUGGCGCUGGAGCCGAUGAAGGACGCGAUUACCUGCGAAAAGCCCCGACGAGCUGGAGAUACGCUUUGACUCGGGGAUGUCCGAAUGGGGAAACCCACCUCGUAAGAGGUAUCCGCAAGGAUGGGAACUCAGGGAACUGAAACAUCUCAGUACCUGAAGGAGAAGAAAGAGAAUUCGAUUCCGUUAGUAGCGGCGAGCGAACCCGGAUCAGCCCAAAUUCAACCCCUCAAGCCGAAGUGGCUGGAAAGCUACACCUCAGAAGGUGAGAGUCCUGUAGGCGAACGAGCGGUUGACUGUAAGGUCGUUGUUCGUGAAACGAUGACUGAAUCCGCGCGGACCACCGCGCAAGGCUAAAUACUCCCAGUGACCGAUAGCGCAUAGUACCGUGAGGGAAAGGUGAAAAGAACCCCGGGAGGGGAGUGAAAGAGAACCUGAAACCGUGGACUUACAAGCAGUCAUGGCACCUUAUGCGUGUUAUGGCGUGCCUAUUGAAGCAUGAGCCGGCGACUUAGACCUGACGUGCGAGCUUAAGUUGAAAAACGGAGGCGGAGCGAAAGCGAGUCCGAAUAGGGCGGCAUUAGUACGUCGGGCUAGACUCGAAACCAGGUGAGCUAAGCAUGACCAGGUUGAAACCCCCGUGACAGGGGGCGGAGGACCGAACCGGUGCCUGCUGAAACAGUCUCGGAUGAGUUGUGUUUAGGAGUGAAAAGCUAACCGAACCUGGAGAUAGCUAGUUCUCCCCGAAAUGUAUUGAGGUACAGCCUCGGAUGUUGACCAUGUCCUGUAGAGCACUCACAAGGCUAAGGGCACGUAAUGUGUUCUAAACCUUAUGAAACUCCGAAGGGGCACGCGUUUAGUCCGGGAGUGAGGCUGCGAGAGCUAACUUCCGUAGCCGAGAGGGAAACAACCCAGACCAUCAGCUAAGGUCCCUAAAUGAUCGCUCAGUGGUUAAGGAUGUGUCGUCGCAUAGACAGCCAGGAGGUUGGCUUAGAAGCAGCCACCCUUCAAAGAGUGCGUAAUAGCUCACUGGUCGAGUGACGAUGCGCCGAAAAUGAUCGGGGCUCAAGUGAUCUACCGAAGCUAUGGAUUCAACUCGCGAAGCGAGUUGUCUGGUAGGGGAGCGUUCAGUCCGCGGAGAAGCCAUACCGGAAGGAGUGGUGGAGCCGACUGAAGUGCGGAUGCCGGCAUGAGUAACGAUAAAAGAAGUGAGAAUCUUCUUCGCCGUAAGGACAAGGGUUCCUGGGGAAGGGUCGUCCGCCCAGGGAAAGUCGGGACCUAAGGUGAGGCCGAACGGCGCAGCCGAUGGACAGCAGGUCAAGAUUCCUGCACCGAUCAUGUGGAGUGAUGGAGGGACGCAUUACGCUAUCCAAUGCCAAGCUAUGGCUAUGCUGGUUGGUACGCUCAAGGGCGAUCGGGUCAGAAAAUCUACCGGUCACAUGCCUCAGACGUAUCGGGAGCUUCCUCGGAAGCGAAGUUGGAAACGCGACGGUGCCAAGAAAAGCUUCUAAACGUUGAAACAUGAUUGCCCGUACCGCAAACCGACACAGGUGUCCGAGUGUCAAUGCACUAAGGCGCGCGAGAGAACCCUCGUUAAGGAACUUUGCAAUCUCACCCCGUAACUUCGGAAGAAGGGGUCCCCACGCUUCGCGUGGGGCGCAGUGAAUAGGCCCAGGCGACUGUUUACCAAAAUCACAGCACUCUGCCAACACGAACAGUGGACGUAUAGGGUGUGACGCCUGCCCGGUGCCGGAAGGUCAAGUGGAGCGGUGCUGCGAAAUGAAGCCCCGGUGAACGGCGGCCGUAACUAUAACGGUCCUAAGGUAGCGAAAUUCCUUGUCGGGUAAGUUCCGACCUGCACGAAAGGCGUAACGAUCUGGGCGCUGUCUCAACGAGGGACUCGGUGAAAUUGAAUUGGCUGUAAAGAUGCGGCCUACCCGUAGCAGGACGAAAAGACCCCGUGGAGCUUUACUAUAGUCUGGCAUUAACCUGAAAAAUCACUUUCGGGGACCGUGCUUGGCGGGUAGUUUGACUGGGGCGGUCGCCUCCCAAAAUGUAACGGAGGCGCCCAAAGGUCACCUCAAGACGGUUGGAAAUCGUCUGUAGAGCGCAAAGGUAGAAGGUGGCUUGACUGCGAGACUGACACGUCGAGCAGGGAGGAAACUCGGGCUUAGUGAACCGGUGGUACCGUGUGGAAGGGCCAUCGAUCAACGGAUAAAAGUUACCCCGGGGAUAACAGGCUGAUCUCCCCCGAGAGUCCAUAUCGGCGGGGAGGUUUGGCACCUCGAUGUCGGCUCGUCGCAUCCUGGGGCUGAAGAAGGUCCCAAGGGUUGGGCUGUUCGCCCAUUAAAGCGGCACGCGAGCUGGGUUCAGAACGUCGUGAGACAGUUCGGUCUCUAUCCGCUACGGGCGCAGGAGAAUUGAGGGGAGUUGCUCCUAGUACGAGAGGACCGGAGUGAACGGACCGCUGGUCUCCCUGCUGUCGUACCAACGGCACAUGCAGGGUAGCUAUGUCCGGAACGGAUAACCGCUGAAAGCAUCUAAGCGGGAAGCCAGCCCCAAGAUGAGUUCUCCCACUGUUCAGGUAAGACUCCCGGAAGACCACCGGGUUAAGAGGCCAGGCGUGCACGCAUAGCAAUGUGUUCAGCGGACUGGUGCUCAUCAGUCGAGGUCUUGACCACAACGUUGGGACGUGGUGCGUAGGAUAGGUGGGAGGCGAAGAACCCUGGCUACGGCUGGGGGGAGCCGCCGGUGAAAUACCACCCUCUACUCUUUGACGUUGUAAGUGCAAGCAAA,2014-07-09,Crystal Structure of a Streptomycin Dependent Ribosome from E. Coli 70S Ribosome.,N/A
8H6L_0,AGCUUUGCGCAGUGGCAGUAUCGUAGCCAAUGAGGUCUAUCCGAGGCGCGAUUAUUGCUAAUUUUUUCCCCCGCCGUGACGACUUGCAAUAUAGUCGGCACUGGCAAUUUUUGACAGUCUCGAGACUG,2024-05-01,Cryo-EM structure of human exon-defined spliceosome in the early B state.,N/A
8TNS_0,GUGUGUGUGUGUGUGUGUGUGUGU,2023-11-15,Solution structure of poly(UG) RNA (GU)12 G-quadruplex,N/A
8ZP7_0,GUGAACCGGAUUGCCGUCAGGAAAUUAGGUGCGCUUAGCAGUAUUCCCCACGCUGUGGG,2024-12-04,"Cryo-EM structure of Cas5-HNH Cascade bound with sDNA, Conf1",N/A
8ZP7_1,DGDCDTDADADGDCDGDCDADCDCDTDADADTDTDTDCDCDTDGDADCDGDGDCDADADTDCDCDT,2024-12-04,"Cryo-EM structure of Cas5-HNH Cascade bound with sDNA, Conf1",N/A
7Z4D_0,AAAGAUGAGACGCGUUUUAGAGCUAGAAAUAGCAAGUUAAAAUAAGGCUAGUCCGUUAUCAACUUGAAAAAGUGA,2022-08-31,Crystal structure of SpCas9 bound to a 10 nucleotide complementary DNA substrate,N/A
8CBL_0,GUAAAUAUAGUUUAAAAACAUCAGAUUGUGAAUCUGACAACAGAGGCUUACCCCCUUAUUUACCGAGAAAGCCAUGCAUGGCUUUC,2024-06-12,"Structure of human mitochondrial RNase Z in complex with mitochondrial pre-tRNA-His(0,Ser)",N/A
9C6K_0,GUACUCGGGGUGCCCUUCUGCGUGAAGGCUGAGAAAUACCCGUAUCACCUGAUCUGGAUAAUGCCAGCGUAGGGAAGUGC,2024-12-04,Cryo-EM structure of the TPP riboswitch embedded in an RNA scaffold bound to thiamine pyrophosphate,N/A
4V49_0,CCCCCGUGCCCAUAGCACUGUGGAACCACCCCACCCCAUGCCGAACUGGGUCGUGAAACACAGCAGCGCCAAUGAUACUCGGACCGCAGGGUCCCGGAAAAGUCGGUCAGCGCGGGGG,2014-07-09,Crystal Structure of a Streptomycin Dependent Ribosome from E. Coli 70S Ribosome.,N/A
8PNF_0,AUUUUUUUUUUUUU,2024-11-20,HRV B14 virion proteins,N/A
8IP8_0,UACCUGGUUGAUCCUGCCAGUAGUCAUAUGCUUGUCUCAAAGAUUAAGCCAUGCAUGUGCAAGUAUGAACCAAUUUGAACUGUGAAACUGCGAAUGGCUCAUUAAAUCAGUUAUAGUUUGUUUGAUGGUACGUGCUACUCGGAUAACCGUAGUAAUUCUAGAGCUAAUACGUGCAACAAACCCCGACUUCUGGGAGGGGCGCAUUUAUUAGAUAAAUCCGAUGAUUCAUGAUAACUCGACGGAUCGCACGGCCUUCGUGCCGGCGACGCAUCAUUCAAAUUUCUGCCCUAUCAACUUUCGAUGGUAGGAUAGGGGCCUACCAUGGUGGUGACGGGUGACGGAGAAUUAGGGUUCGAUUCCGGAGAGGGAGCCUGAGAAACGGCUACCACAUCCAAGGAAGGCAGCAGGCGCGCAAAUUACCCAAUCCUGACACGGGGAGGUAGUGACAAUAAAUAACAAUACCGGGCGCAUUAGUGUCUGGUAAUUGGAAUGAGUACAAUCUAAAUCCCUUAACGAGGAUCCAUUGGAGGGCAAGUCUGGUGCCAGCAGCCGCGGUAAUUCCAGCUCCAAUAGCGUAUAUUUAAGUUGUUGCAGUUAAAAAGCUCGUAGUUGGACCUUGGGCCGGCCGGCAUCGCGCUCCUAGCCCGGCAUCGUUACUUUGAAGAAAUUAGAGUGCUCAAAGCAAGCCAUCGCUCUGGAUACAUUAGCAUGGGAUAACAUCAUAGGAUUCCGGUCCUAUUGUGUUGGCCUUCGGGAUCGGAGUAAUGAUUAAUAGGGACAGUCGGGGGCAUUCGUAUUUCAUAGUCAGAGGUGAAAUUCUUGGAUUUAUGAAAGACGAACAACUGCGAAAGCAUUUGCCAAGGAUGUUUUCAUUAAUCAAGAACGAAAGUUGGGGGCUCGAAGACGAUCAGAUACCGUCCUAGUCUCAACCAUAAACGAUGCCGACCAGGGAUCGGCGGAUGUUGCUUAUAGGACUCCGCCGGCACCUUAUGAGAAAUCAAAGUCUUUGGGUUCCGGGGGGAGUAUGGUCGCAAGGCUGAAACUUAAAGGAAUUGACGGAAGGGCACCACCAGGCGUGGAGCCUGCGCUUAAUUUGACUCAACACGGGGAAACUUACCAGGUCCAGACAUAGCAAGGAUUGACAGACUGAGAGCUCUUUCUUGAUUCUAUGGGUGGUGGUGCAUGGCCGUUCUUAGUUGGUGGAGCGAUUUGUCUGGUUAAUUCCGUUAACGAACGAGACCUCAGCCUGCUAACUAGCUAUGCGGAGCCAUCCCUCCGCAGCUAGCUUCUUAGAGGGACUAUGGCCGUUUAGGCCACGGAAGUUUGAGGCAAUAACAGGUCUGUCAUGCCCUUAGAUGUUCUGGGCCGCACGCGCGCUACACUGAUGUAUUCAACGAGUAUAUAGCCUUGGCCGACAGGCCCGGGUAAUCUUGGGAAAUUUCAUCGUGAUGGGGAUAGAUCAUUGCAAUUGUUGGUCUUCAACGAGGAAUGCCUAGUAAGCGCGAGUCAUCAGCUCGCGUUGACUACGUCCCUGCCCUUUGUACACACCGCCCGUCGCUCCUACCGAUUGAAUGGUCCGGUGAAGUGUUCGGAUCGCGGCGACGGACGUCGCGAGAAGUCCAUUGAACCUUAUCAUUUAGAGGAAGCAGAAGUCGUAACAAGGUUUCCGUAGGUGAACCUGCGGAAGGAUCAUUG,2024-02-21,Wheat 80S ribosome stalled on AUG-Stop boron dependently,N/A
8P8B_0,GCAUCUUUAGCUCAGUUGGUAGAGCAAAUGACUCUUAAUCAUUGGGUCGGGGGUUCGAGCCCCUCAAGAUGCACCA,2024-11-20,Mycoplasma pneumoniae large ribosomal subunit in chloramphenicol-treated cells,N/A
4NIA_0,UUUUUUUUUUUUUUUUUUUUUUUUUUUUUUUUUUUUUUUU,2014-09-10,Satellite Tobacco Mosaic Virus Refined at room temperature to 1.8 A Resolution using NCS Restraints,N/A
8WCS_0,UGCUUCACGUAGGCCUUGGAGCCGUACAUGGUUGUAACAAGCCUAAGUUUGAAAGGUAAAAACAAC,2024-05-22,Cryo-EM structure of Cas13h1-crRNA binary complex,N/A
2IZ9_0,AUGAGGAUACCCAU,2006-07-27,MS2-RNA HAIRPIN (4ONE -5) COMPLEX,N/A
8HZL_0,GGGGAAAAGGAAUUUUGGUUAAAAAACCAAGGCCGGAAGGAAUUUUGGUUAAAAAACCAAGGCCGGAAGGAAUUUUGGUUAAAAAACCAAUUGGCCCCGGAAAAAAGGGGCCAAGGAACCAACCUUCCGGCCGGAACCAACCUUCCGGCCGGAACCAACCUUUUUUCC,2024-06-19,A new fluorescent RNA aptamer_III bound with N,N/A
8GLP_0,CGACUCUUAGCGGGGAUCACUCGGCUCGUGCGUCGAUGAAGAACGCAGCUAGCGCGAGAAUUAAUGGAAUUCAGGACACAUUGAUCAUCGACACUUCGAACGCACUUGCGGCCCCGGGUUCCUCCCGGGGCUACGCCUGUCUGAGCGUCGCU,2023-04-19,mRNA decoding in human is kinetically and structurally distinct from bacteria (Consensus LSU focused refined structure),N/A
8GLP_1,CGCGACCUCAGAUCAGACGUGGCGACCCGCUGAAUUUAAGCAUAUUAGUCAGCGGAGGAGAAGAAACUAACCAGGAUUCCCUCAGUAACGGCGAGUGAACAGGGAAGAGCCCAGCGCCGAAUCCCCGCCCCGCGGCGGGGCGCGGGACAUGUGGCGUACGGAAGACCCGCUCCCCGGCGCCGCUCGUGGGGGGCCCAAGUCCUUCUGAUCGAGGCCCAGCCCGUGGACGGUGUGAGGCCGGUAGCGGCCCCCGGCGCGCCGGGCCCGGGUCUUCCCGGAGUCGGGUUGCUUGGGAAUGCAGCCCAAAGCGGGUGGUAAACUCCAUCUAAGGCUAAAUACCGGCACGAGACCGAUAGUCAACAAGUACCGUAAGGGAAAGUUGAAAAGAACUUUGAAGGGAGUUCAAGAGGGCGUGAAACCGUUAAGAGGUAAACGGGUGGGGUCCGCGCAGUCCGCCCGGAGGAUUCAACCCGGCGGCGGGUCCGGCCGUGUCGGCGCGGCGGAUCUUUCCCGGCGGGGGACCGUCCCCCGACCGGCGACCGGCCGCCGCCGGGCGCAUUUCCACCGCGGCGGUGCGCCGCGACCGGCUCCGGGACGGCUGGGAAGGCCCGGCGGGGAAGGUGGCUCGGGGGCCCCCGAGUGUUACAGCCCCCCCGGCAGCAGCACUCGCCGAAUCCCGGGGCCGAGGGAGCGAGACCCGUCGCCGCGCUCUCCCCCCUGGGGGGGCCGGGCCACCCCUCCCACGGCGCGACCGCUCGGGGCGGACUGUCCCCAGUGCGCCCCGGGCGGGUCGCGCCGUCGGGCCCGGGGGGCCACGCGCGCGUCCCCCGAAGAGGGGGACGGCGGAGCGAGCGCACGGGGUCGGCGGCGACGUCGGCUACCCACCCGACCCUCUUGAACCGGACCAAGGAGUUAACACGUGCGCGAGUCGGGGGCUCGCACGAAAGCCGCCGUGGCGCAAUGAAGGUGAAGGCCGGCGCGCUCGCCGGCCGAGGUGGGAUCCCGAGGCCUCUCCAGUCCGCCGAGGGCGCACCACCGGCCCGUCUCGCCCGCCGCGCCGGGGAGGUGGAGCACGAGCGCACGUGUUAGGACCCAAGAUGGUGACAUGCCUGGGCAGGGCGAAGCCAGAGGAAACUCUGGUGGAGGUCCGAGCGGUCCUGACGUGCAAAUCGGUCGUCCGACCUGGGUAUAGGGCGAAAGACUAAUCGAACCAUCUAGUAGCUGGUUCCCUCCGAAGUUUCCCCAGGAAGCUGGCGCUCUCGCAGACCCGAGCCACGCAGUUUUAUCCGGUAAAGCGAAGAUUAGAGGUCUUGGGGCCGAAACGAUCUCAACCACUCAAACUUAAAUGGGUAAGAAGCCCGGCUCGCUGGCGUGGAGCCGGGCGUGGAAUGCGAGUGCCUAGUGGGCCACUUGGUAAGCGAACUGGCGUGCGGGAUGAACCGAACGCCGGGUUAAGGCGCCCGAUGCCGACGCUCAUCAGACCCCAGAAAAGGUGUUGGUUGAUAUAGACAGCAGGAACCUGCCGAAUCAACUAGCCCUGAAAAUGGAUGGCGCUGGAGCGUCGGGCCCAUACCCGGCCGUCGCCGGCAGUCGAGAGUGGACGGGAGCCCCGCGGACGCUACGCCGCGACGAGUAGGAGGGCCGCUGCGGUGAGCCUUGAAGCCUAGGGCGCGGGCCCGGGUGGAGCCGCCGCAGGUGCAGAUUUGGUGGUAGUAAAUAUUCAAACGAGAACUUUGAAGGCCGAAGUGGGAAGGGUUCCAUGGAACAGAUUGAACAUGGGUCAGUCGGUCCUGAGAGAUGGGCGAGCGCCGUUCCGAAGGGACGGGCGAUGGCCUCCGUUGCCCUCGGCCGACGAAAGGGAGUCGGGUUCAGAUCCCCGAAUCCGGAGCGGAGAUGGGCGCCGCGAGGCGUCCAGUGCGGUAACGCGACCGAUCCCGGAGAAGCCGGCGGGAGCCCCGGGGAGAGUUCUCUUUCUUUGUGAAGGGCAGGGCGCCCUGGAAUGGGUUCGCCCCGAGAGAGGGGCCCGUGCCUUGGAAAGCGUCGCGGUUCCGGCGGCGUCCGGUGAGCUCUCGCUGGCCCUUGAAAAUCCGGGGGAGAGGGUGUAAAUCUCGCGCCGGGCCGUACCCUAUCCGCAGCAGGUCUCAAGGUGAACGCCUCUGGAUGUUGGAACAAGAGGAAGGGAAGUCGGCAAGCGGAUCCGUAACUUCGGAUAAGGAUUGGCUCUAAGGGCUGGUAGCAGCCGACUUAGAACUGGUGCGGACCAGGGAAUCCGACGUUAAUUAAAACAAAGCAUCGCGAAGGCCCGCGGCGGGUGUUGACGCGAUGUGAUUCUGCCAGUGCUCUGAAUGCAAGUGGAAAUCAAGAAGCGCGGUAAACGGCGGGAGACAGACCCUUAAGGUAGCAAUGCCUCUCAUCUAAUUAGUGAGCGCAUGAAGGAUGACGAGUUCCCACUGUCCACCUACACCAGCGAAACCACGCAAGGGAACGGGCUGGGGAAUCAGCGGGAAAGAAGACCCUGUUGAGCUGACCUAGUCUGGCACGGUGAAAGACGUUUUUUCACUGACCCGGUGAGGCGGGGGGGCGAGCCCCGAGGGGCUCUCGCUUCUGGCGCCAAGCGCCCGGCCGCGCGCCGGCCGGGCGCGACCCGCUCCGGGGACAGUGCCAGGUGGGGAGUUUGACUGGGCGGUACACCUGUCAAACGGUACGCAGGUCCUAAGGCGAGCUCAGGGAGGACAGAAACCUCCCGUGGAGCAGAAGGGCAAAAGCUCGCUUGACUGAUUUCAGACGAAACAGACCGUGAAAGCGGGGCCUCACGAUCCUUCUGACCUUUGGGUUUAAGCAGGAGUGUCAGAAAAGUUACCACAGGAUAACUGGCUGUGGCGGCCAAGCGUCAAGCGACGCGCUUUUUGACCUUGAUGUCGGCUUCCUAUCAUUGGAAGCAGAAUUCACCAAGCGUGAUUCACCCACUAAUAGGGAACGGGCUGGGAGACGUCGUGAGACAGGUAGUUUUACCCUACUGAGUGUGUGUGCCAUGGUAUCCUGCUCAGUACGAGAGGAACCGCAGUCAACAUUGGUGUAUGCUUGGCUGAGGAGCCAAUGGGGCGAAGCUACCACUGUGGGAUUAUGACGAACGCCUCUAAGUCAGAAUCCCGCCCAGGCGGAACGAUACGGCAGCGCCGCGGAGCCUCGGUUGGCCUCGGAUAGCCGGUCCCCCGCGGGGUCCGGUGCGGAGUGCCCUUCGUCCUGGGAAACGGGGCGCGGCCGGAGAGGCGGCCGCCCCCUCGCCCGUCACGCACCGCACGUUCGUGGGGAACCUGGCGCUAAACCAUCGUAGACGACCUGCUUCUGGGUCGGGGUUCGUACGAGCAGAGCAGCGCUGCGAUCUAUUGAAAGUCAGCCCUCGACACAAGGGUUUGU,2023-04-19,mRNA decoding in human is kinetically and structurally distinct from bacteria (Consensus LSU focused refined structure),N/A
6B0B_0,UAAAAAAA,2017-10-25,Crystal structure of human APOBEC3H,N/A
6B0B_1,UUUUUUUU,2017-10-25,Crystal structure of human APOBEC3H,N/A
8VAK_0,AAAAAAA,2024-11-20,E.coli PNPase in complex with double 8-oxoG RNA,N/A
5BKL_0,AAAAAAAAAAAAAAAAAAAAAAAAAAAAAAAAA,2021-12-15,Crystallographic structure of the cubic crystal form of STMV (77.9 degree rotation) grown from NaCl,N/A
5BKL_1,UUUUUUUUUUUUUUUUUU,2021-12-15,Crystallographic structure of the cubic crystal form of STMV (77.9 degree rotation) grown from NaCl,N/A
5J2W_0,GGCAGAUCUGAGCCUGGGAGCUCUCUGCC,2016-06-08,Intermediate state lying on the pathway of release of Tat from HIV-1 TAR.,N/A
4PDQ_0,UUGCGUCACGCCGGCGAAGUCGC,2015-01-07,Crystal structure of the bacterial ribosomal decoding site in complex with 4'-deoxy-4'-fluoro neomycin analog,N/A
4PDQ_1,UUGCGUCACGCCGGCGAAGUCGC,2015-01-07,Crystal structure of the bacterial ribosomal decoding site in complex with 4'-deoxy-4'-fluoro neomycin analog,N/A
5UJ2_0,UAAAUUU,2017-03-22,"Crystal structure of HCV NS5B genotype 2A JFH-1 isolate with S15G E86Q E87Q C223H V321I mutations and Delta8 neta hairpoin loop deletion in complex with GS-639476 (diphsohate version of GS-9813), Mn2+ and symmetrical primer template 5'-AUAAAUUU",N/A
5UJ2_1,AAUUU,2017-03-22,"Crystal structure of HCV NS5B genotype 2A JFH-1 isolate with S15G E86Q E87Q C223H V321I mutations and Delta8 neta hairpoin loop deletion in complex with GS-639476 (diphsohate version of GS-9813), Mn2+ and symmetrical primer template 5'-AUAAAUUU",N/A
