target_id,sequence,temporal_cutoff,description,all_sequences
7KUC_0,GGAGGAAGGAGCCUCC,2022-06-01,Ax1 Domain of VEGF Readthrough Element,N/A
7KUD_0,GGUUUCGGGAACC,2022-06-01,Ax2 Domain of VEGF Readthrough Element,N/A
7ZEX_0,UAAUGUCG,2022-05-04,Complex Cyp33-RRMdelta alpha : UAAUGUCG RNA,N/A
7KUB_0,CUGCUCUACCUUCACCAUGCCAAGUGGUCCCAGGCUGCACCCAUGGCAGAAGGAGGGCAG,2022-06-01,Au1 Domain of VEGF Readthrough Element,N/A
9CDB_0,AAA,2024-10-30,"CryoEM structure of CRISPR associated effector, CARF-Adenosine deaminase 1, Cad1, in cA6 (partial density) bound form with ATP (partial density).",N/A
7ZEW_0,AAUAAA,2022-04-13,Complex Cyp33-RRM : AAUAAA RNA,N/A
7RWR_0,GGAUACACAAGAGUGAUUGAAACUAAGUCUGUGUAUCC,2022-07-20,An RNA aptamer that decreases flavin redox potential,N/A
7SHX_0,GGACCCAUAACCCACCUAGACCCUAGCUUCGGCUAGAGGGUCAACGCGAAAGCGAGGCCGGGUGGGCGGGUACGUCCGCCCUGGGGAGGGGUCC,2022-10-19,"A functional SNP regulates E-cadherin expression by dynamically remodeling the 3D structure of a promoter-associated non-coding RNA transcript, NMR, minimized average structure",N/A
7Q33_0,AGCUUUG,2023-02-08,Solution structure of RBM39 RRM2 bound to 5'-AGCUUUG-3,N/A
4CIO_0,GGUGUGC,2014-09-03,RRM domain from C. elegans SUP-12 bound to GGUGUGC RNA,N/A
7UMD_0,GGACGUGGACCGACUUCGGUCGGAAGGAAACUUAACGUCC,2022-07-06,DENV1 SLA three-way junction RNA (DenvSLAsh),N/A
7PS8_0,CAGGGAGGUGUGGCCUGGGCGGG,2023-04-05,NMR Structure of the U3 RNA G-quadruplex,N/A
7UMC_0,GGAGUGGUUAGUCUACGUGGACCGACAAGACUUCGGUCGAAUCGGAAGGAAACUUAACGUAGUUCUAACC,2022-07-06,DENV1 SLA RNA (DenvSLATL),N/A
8I45_0,GGACGCUUUCGAGCGGUCC,2023-03-29,Interaction between a fluoroquinolone derivative KG022 and RNAs: effect of base pairs 3' adjacent to the bulge out residues,N/A
7VRL_0,UGCAUAU,2022-10-26,Solution structure of Rbfox RRM bound to a non-cognate RNA,N/A
9CPG_0,GACAGCUGCUGUC,2024-08-07,Structures of small molecules bound to RNA repeat expansions that cause Huntington's disease-like 2 and myotonic dystrophy type 1,N/A
9CPG_1,GACAGCUGCUGUC,2024-08-07,Structures of small molecules bound to RNA repeat expansions that cause Huntington's disease-like 2 and myotonic dystrophy type 1,N/A
7QDE_0,AUCCAGUGGAA,2022-12-21,NMR structure of Npl3 RRM12 bound to the AUCCAGUGGAA RNA,N/A
8K15_0,GUACGACGGGCAUGUCGUACAUCUGAGGUGCAAGUCCUCUGUGGACACCUGCUACCGGUGAACCCAAUAGCGACUCCCAAGCCUGACUAUCGCGAGGUAACGGGGAGAGGAAGGGAUAGCGAAAUCGUGGCUCUACGAACAGAAACGUGAUAUUAAGGCGUAUAUAGUGGAUGAGGGGGCUAGGCACUCUAAAGUCCAAAAAGGUAGUCGUAAUCUAUGUGCGUAAAUCACGAGAGUAAACGAGGAAAGAUGUACGACUUAUCCCGUGAGGUCUCAUGAGCGUCAGUAGACGUAGUAAUAACGAAUCAUGAGAAGUCAGCCGAGGUCAUAGUAGUGAUGAAGUUUCUGUAAUGGAAACGGAGCGAAGGACCGAACGAUUAAACAGAACGUAUGCUGUUUAGUUGAACCGCCGUGUGCCGAACGGCACGCACGGUGGUGUGAGAGGGACUAUCAAUUAGUCCCUACUCGAU,2024-05-15,The Streptococcus azizii ORF-less Group IIC intron HYER2 at apo state,N/A
9CPI_0,GACAGCUGCUGUC,2024-08-07,Structures of small molecules bound to RNA repeat expansions that cause Huntington's disease-like 2 and myotonic dystrophy type 1,N/A
9CPI_1,GACAGCUGCUGUC,2024-08-07,Structures of small molecules bound to RNA repeat expansions that cause Huntington's disease-like 2 and myotonic dystrophy type 1,N/A
8I43_0,GGACGCUUUCGAGCCGUCC,2023-03-29,Interaction between a fluoroquinolone derivative KG022 and RNAs: effect of base pairs 3' adjacent to the bulge out residues,N/A
1HG9_0,GCAUAUCAG,2002-01-02,Solution structure of DNA:RNA hybrid,N/A
9CPJ_0,GACAGCUGCUGUC,2024-08-07,Structures of small molecules bound to RNA repeat expansions that cause Huntington's disease-like 2 and myotonic dystrophy type 1,N/A
9CPJ_1,GACAGCUGCUGUC,2024-08-07,Structures of small molecules bound to RNA repeat expansions that cause Huntington's disease-like 2 and myotonic dystrophy type 1,N/A
8BWT_0,GGCGUUUUCGCUUCGGCGUUUACGCC,2023-08-30,Structure of a symmetrical internal loop motif with three consecutive U:U mismatches from stem-loop 1 in the 3'-UTR of the SARS-CoV2 genomic RNA,N/A
8Z97_0,GCCUGUUUUUGCU,2024-05-29,Cryo-EM structure of Thogoto virus polymerase in a transcription elongation conformation,N/A
8Z97_1,GCAAAAACA,2024-05-29,Cryo-EM structure of Thogoto virus polymerase in a transcription elongation conformation,N/A
8JHP_0,ACUCGAAAGAACAUGUUUUCCAAGAGU,2024-05-29,Another hairpin structure found in the RNA element involved in piRNA biogenesis,N/A
6N6H_0,CU,2019-06-12,Vibrio cholerae Oligoribonuclease bound to pCpU,N/A
7FGI_0,U,2022-07-27,Cryo-EM Structure of Chikungunya Virus Nonstructural Protein 1 with m7Gppp-AU,N/A
8WUV_0,GGCCGUAGUGCUUGCUCUGAGUUUUAGAGCUAGAAAUAGCAAGUUAAAAUAAGGCUAGUCCGUUAUCAACUUGAAAAAGUGGCACCGAGUCGGUGCAUGCAACCAAACCACAGCGUGCUCAGUCUG,2024-06-05,SpCas9-MMLV RT-pegRNA-target DNA complex (elongation 16-nt),N/A
7Q48_0,GGGCCAUUGGGUGGGAUCUGGG,2022-11-16,Solution structure of an intramolecular RNA G-quadruplex formed by the 6A8U17U mutant from a 22mer guanine-rich sequence within the 5'UTR of BCL-2 proto onco-gene,N/A
8RDU_0,AGCGCCGCAAUUCAUGCUGCUUGCAGCCUCUGAAUUUUGUUAAAUGAGGGUUAGUUUGACUGUAUAAAUACAGUCUUGCUUUCUGACCCUGGUAGCUGCUCACCCUGAUGCUGCUGUCAAUAGACAGGAUAGGUGCGCUCCCAGCAAUAAGGGCGCGGAUGUACUGCUGUAGUGGCUACUGAAUCACCCCCGAUCAAGGGGGAACCCUCCAAAAGGUGGGUUGAAAGGAGAAGUCAUUUAAUAAGG,2024-06-19,Conformational Landscape of the Type V-K CRISPR-associated TransposonIntegration Assembly CAST V-K composite map,N/A
8JY0_0,GAACCUCCGCCCAUUGCACUCCGGGCGGUGAAGGAGAGGCGCAAGGUUAACCGCCUCAGGUUCC,2024-05-29,Crystal structure of RhoBAST complexed with TMR-DN,N/A
